macauhoi,topic,kynang,mucdo,noidung,A,B,C,D,dapandung,giaithich
df47da23-f3e6-4e7d-be37-f256048ec79f,10,GRAMMAR,2,"500 years ago, the average human ___________ was about 40 years.",lifespan,lifetime,life cycle,life length,A,"A. lifespan /ˈlaɪfspæn/ (n): tuổi thọ | B. lifetime /ˈlaɪftaɪm/ (n): thời gian sống | C. life cycle: vòng đời. Tạm dịch: 500 năm trước, tuổi thọ trung bình của con người ở mức khoảng 40 tuổi."
7281df89-8e57-4f52-8634-e1c243a7a415,9,VOCAB,2,"A/an ___________ is a person who needs others to take care of him/her, because of illness that he/she had for a long time.",patient,martyr,invalid,addict,C,"A. patient: bệnh nhân | B. martyr: liệt sĩ | C. invalid /ɪnˈvælɪd/ (n): người bệnh tật, người tàn tật | D. addict: người nghiện. Tạm dịch: Một người tàn tật là người cần sự chăm sóc của người khác vì bệnh lâu ngày."
c64aeb3c-f03a-41dc-ae7f-69d15b3c1947,1,VOCAB,2,"Accepting that changes are _________ does not mean that we will allow everything to be wiped out, destroyed or forgotten.",avoidable,unavoidable,stoppable,unstoppable,B,"A. avoidable /əˈvɔɪdəbl/ (a): có thể tránh được | B. unavoidable /ˌʌnəˈvɔɪdəbl/ (a): không thể tránh được | C. stoppable /ˈstɒpəbl/ (a): có thể dừng lại | D. unstoppable /ʌnˈstɒpəbl/ (a): không thể dừng lại. Tạm dịch: Việc chấp nhận rằng các thay đổi là điều không thể tránh được không có nghĩa là chúng ta cho phép mọi thứ bị xóa bỏ, phá hủy hay quên lãng."
81b800b4-ff33-4507-9ad4-616bc6eed122,3,VOCAB,2,"Accordingly, urbanization is very common in developing and developed worlds as more and more people have the ___________ of moving closer to towns and cities to acquire “privileged” social and economic services as well as benefits.",tendency,ambition,intention,dream,A,"A. tendency /ˈtendənsi/(n): xu hướng | B. ambition /æmˈbɪʃn/(n): hoài bão, tham vọng | C. intention /ɪnˈtenʃn/(n): ý định, mục đích | D. dream /driːm/(n): giấc mơ. Tạm dịch: Vì lý do đó, sự đô thị hóa rất phổ biến ở các nước phát triển và đang phát triển vì ngày càng có nhiều người có xu hướng dịch chuyển đến gần các thành phố, thị xã để có được các quyền lợi xã hội, các dịch vụ kinh tế cũng như lợi ích."
af9c9f89-47d7-4921-bea1-72cc803b2941,12,GRAMMAR,2,"According to a survey, a lot of young people prefer to live in ___________ families which consist of parents and children.",nuclear,extended,three generation,four generation,A,"A. nuclear /'nju:klɪər/ (a): hạt nhân | B. extended (a): mở rộng. Cấu trúc: Nuclear family: gia đình hạt nhân (bố mẹ và con cái). Tạm dịch: Theo một nghiên cứu, rất nhiều người trẻ thích sống trong những gia đình hạt nhân, chỉ có bố mẹ và con cái."
b681055d-9aa2-416f-aab0-13378de53afd,18,VOCAB,2,According to futurist Ray Kurzweil human _____ will be unavoidably transformed in the year 2045 by an event that he call The Singularity.,civics,civilization,cavils,civilians,B,"A. civics /'sɪvɪks/ (v): ngành nghiên cứu quyền và nghĩa vụ của công dân | B. civilization /ˌsɪvəlaɪˈzeɪʃən/ (n): nền văn minh | C. cavil /'kævəlz/ (v): cãi bướng, cãi vặt | D. civilians /sɪ'vɪljən/ (n): dân thường. Tạm dịch: Theo như những người theo thuyết vị lai Ray Kurzweil, nền văn minh của loài người sẽ không thể tránh khỏi bị biến đổi vào năm 2045 bởi một sự kiện mà ông gọi là The Singularity."
dfb1f2ad-da5a-4e32-a577-d475a2aae6c6,26,VOCAB,2,"According to Public Health England, 40% of the over 50s are leading _____ lifestyles these days.",depressive,vulnerable,powerful,sedentary,D,"A. depressive /dɪˈpresɪv/ (a): làm suy nhược, suy yếu | B. vulnerable /ˈvʌlnərəbl/ (a): dễ tổn thương | C. powerful /ˈpaʊəfl/ (a): hùng mạnh | D. sedentary /ˈsedntri/ (a): ngồi nhiều, ít đi chỗ khác. Tạm dịch: Theo cơ quan Y tế công cộng của Anh, 40% trong số những người trên 50 tuổi đang có lối sống ít vận động những ngày này."
2fb80d3b-a34f-404b-8b26-faabdcf8c87e,20,VOCAB,2,"According to the chairman's spokesperson, further _____ in the marketing division are to be expected.",cutbacks,breakdowns,layouts,drop-backs,A,"A. cutbacks /ˈkʌtbæk/ (n): sự cắt giảm | B. breakdowns /ˈbreɪkdaʊn/ (n): sự hỏng hóc, suy sụp, tan vỡ, thất bại | C. layouts /ˈleɪaʊt/ (n): bản thiết kế, bố cục, sự bố trí | D. drop-backs / drɒpbæks/ (n): bị bỏ lại, tụt hậu. Tạm dịch: Theo người phát ngôn của Chủ tịch, người ta dự kiến sẽ cắt giảm thêm trong bộ phận tiếp thị."
169dda21-c29a-419c-a1d7-a97c795c2860,13,GRAMMAR,2,"According to the dictionary, friendship is a feeling and ___________ that exist between people, but what these feelings are and what this behavior is everyone should decide for himself.",behavior,behave,behaved,behaviors,A,"A. behavior /bɪ'heɪvjər/ (n): hành vi, cách cư xử. Tạm dịch: Theo từ điển, tình bạn là một cảm giác và hành vi tồn tại giữa con người với nhau, nhưng những cảm giác này là gì và hành vi này là gì mỗi người nên tự quyết định."
53eef0d2-7294-4ed7-a49e-40ea711d8a4e,16,GRAMMAR,2,"According to the latest _____ figures, 119 boys are born for every 100 girls.",census,censure,censurable,censor,A,"A. census /‘sensəs/ (n): việc điều tra dân số | B. censure /'senʃər / (n): sự phê bình, chỉ trích | C. censurable /'sənʃərəbl/ (a): đáng phê bình, khiển trách | D. censor /'sensə/ (n): giám thị, nhân viên kiểm duyệt. Tạm dịch: Theo số liệu điều tra dân số mới nhất cứ 119 bé trai thì có 100 bé gái được sinh ra."
3b97b9af-5284-45be-94b9-6aa8b77768c6,18,VOCAB,2,"Aerial, ground and marine robots are used in intelligence surveillance and reconnaissance (ISR) applications, bomb disposable and cargo _____.",transports,transportation,traffic,transmission,B,"A. transport /ˈtrænspɔːt/ (n): phương tiện giao thông | B. transportation /ˌtrænspɔːˈteɪʃn/ (n): sự vận tải, chuyên chở | C. traffic /ˈtræfɪk/ (n): sự đi lại, giao thông | D. transmission /trænzˈmɪʃn/ (n): sự truyền, chuyển giao. Tạm dịch: Robot trên không, trên mặt đất và trên biển được sử dụng trong các ứng dụng trinh sát tình báo (ISR), bom dùng một lần và vận chuyển hàng hóa."
5fe99783-917a-41e0-852a-c63349734d96,12,GRAMMAR,2,"A family can be two or more people who share goals and values, have long-term ___________ to one another, and usually live in the same house.",commit,commitments,committed,commutative,B,"A. commit (v): phạm tội | B. commitment /kə'mɪtmənt/ (n): sự cam kết, sự tận tụy | C. committed (a): tận tụy | D. commutative (a): thay thế. Tạm dịch: Một gia đình có thể có hai hay nhiều người, người mà chia sẻ những mục tiêu và giá trị, có một sự cam kết dài hạn với nhau và thường sống chung một nhà."
f5394cc6-8757-4a49-813a-25ec5ba7e430,28,VOCAB,2,"A few people argue that the special events need to be celebrated _____ , as it happens only a few times in a lifetime.",nicely,grandly,expressively,tremendously,B,"A. nicely /ˈnaɪsli/ (adv): thú vị, dễ chịu, xinh | B. grandly /ˈɡrændli/ (adv): đàng hoàng, long trọng, đâu ra đấy | C. expressively /ɪkˈspresɪvli/ (adv): truyền cảm | D. tremendously /trəˈmendəsli/ (adv): ghê gớm, khủng khiếp, rất lớn. Tạm dịch: Một số ý kiến cho rằng các sự kiện đặc biệt cần được tổ chức một cách long trọng vì nó chỉ xảy ra một vài lần trong đời."
0e9748c6-49c7-404f-a385-48c8c979423f,13,VOCAB,2,"A friend is a person who can help you in no time, lend you a hand, who supports you in all your beginnings and who will never ___________ you.",mock,deceive,tease,pretend,B,"A. mock (v): chế nhạo | B. deceive /dɪ'si:v/ (v): lừa dối | C. tease (v): trêu chọc | D. pretend (v): giả vờ. Tạm dịch: Một người bạn là một người có thể giúp bạn không nề hà gì, người ủng hộ bạn trong mọi khởi đầu và sẽ không bao giờ lừa dối bạn."
8c560155-08e8-46ac-8320-cb12dac9f834,3,VOCAB,2,"After a decade of economic liberalization, Vietnam has seen a dramatic rise in living ___________ in urban areas.",surface,standards,levels,backgrounds,B,"A. surface (n): bề mặt | B. standard /ˈstændəd/(n): tiêu chuẩn, mức độ | C. level (n): mức, cấp độ | D. background (n): nền tảng. Tạm dịch: Sau một thập kỷ tự do hóa kinh tế, Việt Nam đã chứng kiến sự gia tăng mạnh mẽ về mức sống ở khu vực thành thị."
f6a1a679-179a-4958-9dcb-892831f8e4cd,2,VOCAB,2,"After a momentary ___________ of concentration, Simon managed to regain his focus and completed the test.",lapse,fault,failure,error,A,"A. lapse /læps/ (n): sự sa ngã, sai xót | B. fault /fɔːlt/ (n): khiếm khuyết, thiếu xót | C. failure /ˈfeɪljə(r)/ (n): sự thất bại | D. error /ˈerə(r)/ (n): lỗi (sai số kỹ thuật,...). Cụm từ : lapse of concentration: sự mất tập trung. Tạm dịch: Sau một vài giây mất tập trung, Simon đã xoay sở để lấy lại tập trung của mình và hoàn thành các bài kiểm tra."
a5d8722f-89b0-47f1-8693-d247e7b5d8ef,20,VOCAB,2,"After a short _____ of being unemployed, I decided to take a risk and set up my own business.",phase,spell,span,session,B,"A. phase /feɪz/ (n): giai đoạn, thời kỳ | B. spell /spel/ (n): đợt, lượt, phiên, thời gian nghỉ ngắn | C. span /spæn/ (n): khoảng, quãng | D. session /ˈseʃn/ (n): buổi họp, phiên họp. Tạm dịch: Sau một thời gian ngắn thất nghiệp, tôi quyết định mạo hiểm và thành lập doanh nghiệp riêng."
e016b8e3-37f3-4842-a3f1-c7f748ea9816,13,GRAMMAR,2,"After graduating from university, she ___________ her mother’s footsteps, starting her own business.",followed in,succeeded in,went after,kept up,A,"Cấu trúc: follow in one's footsteps: tiếp bước ai. Tạm dịch: Sau khi tốt nghiệp đại học, cô tiếp bước mẹ mình và bắt đầu tự kinh doanh."
9b02bfcc-839d-4b34-88c9-560f42ca5184,14,VOCAB,2,"After many weeks, his solo album ___________ a profound influence on the youth all over the country.",remains,maintains,becomes,persuades,A,"A. remain /rɪ'meɪn/ (v): vẫn còn | B. maintain (v): duy trì | C. become (v): trở thành | D. persuade (v): thuyết phục. Tạm dịch: Sau nhiều tuần, album đơn của cô ấy vẫn giữ được ảnh hưởng đối với giới trẻ."
eee5a0fa-90c6-446a-bd31-05a3cb08607c,29,GRAMMAR,2,"After nearly five months of _____ , the first tenants of the international space station said they are eager to return to Earth.",weight,weighting,weightless,weightlessness,D,"A. weight /'weɪt (n): trọng lượng | B. weighting /'weɪtɪŋ/ (n): khoản thanh toán thêm, phụ cấp thêm (trong các trường hợp đặc biệt) | C. weightless /'weɪtləs/ (a): không trọng lượng | D. weightlessness /'weɪtləsnəs/ (n): tình trạng không trọng lượng. Tạm dịch: Sau gần năm tháng ở trong tình trạng không trọng lượng, những người chủ sở hữu đầu tiên của trạm không gian quốc tế nói rằng họ háo hức quay về trái đất."
89a2850e-e048-466f-956c-712e1d56f781,10,GRAMMAR,2,"After spending a week in bed, she made a complete ___________.",recover,recovering,recovery,recovered,C,"A. recover /rɪˈkʌvər/ (v): hồi phục | B. recovering /rɪˈkʌvərɪŋ/ (V-ing) | C. recovery /rɪˈkʌvəri/ (n): sự hồi phục | D. recovered /rɪˈkʌvərd/ (V-ed). Căn cứ vào tính từ ""complete"" thì trong ô trống ta cần một danh từ. Tạm dịch: Sau khi phải nằm cả tuần trên giường bệnh, cô ấy đã hồi phục hoàn toàn."
16988fe3-02d1-474d-813e-a2f5853e7e95,19,VOCAB,2,"After the Mongol invasion of 1241, a _____ was built on the hills opposite the city.",citadel,pyramid,villa,palace,A,A. citadel /'sɪtədel/ (n): cố đô | B. pyramid /'pɪrəmɪd/ (n): Kim Tự tháp | C. villa /'vɪlə/ (n): biệt thự | D. palace /'pælɪs/ (n): tòa lâu đài. Tạm dịch: Sau sự xâm lược của Mông Cổ vào năm 1241 một cố đô đã được xây trên đồi đối diện thành phố.
afd3fe56-d2a9-436d-9987-6eb92d553d51,9,GRAMMAR,2,"After the visit to that special school, we ___________ friends with some students with reading disabilities.",acquainted,had,made,realized,C,"Cấu trúc: make friend: kết bạn. Tạm dịch: Sau chuyến thăm ngôi trường đặc biệt đó, chúng tôi đã kết bạn với một số học sinh mắc chứng khó đọc."
04f34817-93cc-492b-ac77-28e0ff865d5b,27,VOCAB,2,"After using an app to learn English on mobile phone, his understanding of the language is growing _____",from time to time,by leaps and bounds,slow but sure,for the time being,B,"A. from time to time: thỉnh thoảng | B. by leaps and bounds: tiến bộ nhanh chóng | C. slow but sure: chậm mà chắc | D. for the time being: trong thời gian này. Tạm dịch: Sau khi sử dụng một ứng dụng để học tiếng Anh trên điện thoại di động, sự hiểu biết về ngôn ngữ của anh ấy đang tiến bộ nhanh chóng."
3f089937-5035-4768-875c-0aebd140c319,10,GRAMMAR,2,A healthy ___________ between work and play ensures that everyone has a chance to enjoy their lives.,balance,control,equality,share,A,A. balance /ˈbæləns/ (n): sự cân bằng | B. control /kənˈtrəʊl/ (n): sự kiểm soát | C. equality /iˈkwɒləti/ (n): sự công bằng | D. share /ʃeər/ (n): sự chia sẻ. Cấu trúc: have a chance: có cơ hội. Tạm dịch: Một sự cân bằng hợp lý giữa làm việc và vui chơi đảm bảo rằng mọi người đều có cơ hội tận hưởng cuộc sống.
c0c8d0ee-fbe5-4fa6-95da-049993a8d2df,26,VOCAB,2,A healthy lifestyles with regular stints of exercises and a diet rich in vitamins is a sure way to _____ one’s immune system.,keep up,build up,carry on,stand up,B,A. keep up: duy trì | B. build up: làm tăng | C. carry on: tiếp tục | D. stand up: đứng lên. Tạm dịch: Một lối sống lành mạnh cùng với việc tập thể dục thường xuyên mỗi ngày kết hợp với một thực đơn giàu vitamin là một cách đảm bảo tăng cường hệ miễn dịch.
1f571dee-3a7f-44ec-962e-2f34447fa4a7,14,GRAMMAR,2,A ___________ is a famous cinema actor or actress.,filmgoer,film director,film maker,film star,D,"A. filmgoer (n): người thường đi xem phim ở rạp | B. film director (n): đạo diễn phim | C. film maker (n): nhà làm phim | D. film star /'fɪlm ,stɑ:r/ (n): ngôi sao điện ảnh. Tạm dịch: Một ngôi sao điện ảnh là một nam hoặc nữ diễn viên điện ảnh nổi tiếng."
34a15e65-e962-4fa4-b0d5-d1aaf57fc552,6,VOCAB,2,A ___________ is a wall that is built across a river in order to stop the water flowing and to make a lake.,panel,sail boat,dam,mill,C,"A. panel /ˈpænəl/(n): thanh, ô (cửa) | B. sail boat: thuyền buồm | C. dam /dæm/(n): cái đập | D. mill /mɪl/(n): máy xay, máy nghiền. Tạm dịch: Một cái đập là một bức tường được xây qua một con sông để ngăn nước chảy và tạo thành một cái hồ."
2f54533c-b3c7-4b6a-9dff-9f43e0947662,3,VOCAB,2,"A ___________ is money that is paid by a government or other authority in order to help an industry or business, or to pay for a public service.",capital,subsidy,investment,salary,B,A. capital (n): thủ đô | B. subsidy /ˈsʌbsədi/(n): trợ cấp | C. investment (n): đầu tư | D. salary (n): lương. Tạm dịch: Trợ cấp là tiền được trả bởi chính phủ hoặc cơ quan có thẩm quyền để giúp ngành công nghiệp hoặc doanh nghiệp.
41d7a2cb-bcbe-4a78-b87e-36d3b8f9b9b4,20,GRAMMAR,2,A large proportion of employees from all demographics claimed to be _____ with strict rules and poor working conditions of their companies.,dissatisfied,satisfied,satisfaction,unsatisfactory,A,"A. dissatisfied /dɪsˈsætɪsfaɪd/ (a): không hài lòng, bất mãn | B. satisfied /ˈsætɪsfaɪd/ (a): hài lòng, thỏa mãn | C. satisfaction /ˌsætɪsˈfækʃn/ (n): cảm giác hài lòng, sự thỏa mãn | D. unsatisfactory /ˌʌnˌsætɪsˈfæktəri/ (a): không vừa ý, không thỏa đáng. Cấu trúc: To be dissatisfied with st: không hài lòng, bất mãn với cái gì >< To be satisfied with st: hài lòng, thỏa mãn với cái gì. Tạm dịch: Một tỷ lệ lớn nhân viên từ tất cả các cuộc điều tra xã hội khẳng định rằng họ không hài lòng với các quy tắc nghiêm ngặt và điều kiện làm việc kém của các công ty của họ."
d8b1bfdf-af52-4a76-a619-424d39fa180a,30,VOCAB,2,"Albert Einstein is _____ one of the greatest scientists ever, who had a major impact on the birth of modern quantum Physics.",haphazardly,begrudgingly,indubitably,jovially,C,"A. haphazardly /.haep'haezodli/ (adv): bừa bãi, lung tung | B. begrudgingly /bi'grAdgnjli/ (adv): ghen tị, thèm muốn | C. indubitably /in'd3u:bitobol/ (adv): không thể nghi ngờ, rõ ràng, chắc chắn | D. jovially /'dsouvioli/ (adv): một cách vui vẻ, vui tính. Tạm dịch: Albert Einstein chắc chắn là một trong những nhà khoa học vĩ đai nhất từ trước đến nay, người đã có tác động lớn đến sự ra đời của vật lí lưỡng tử hiện đại."
8c0cc50f-3dc6-4ac7-98d5-3fc198801dc3,28,GRAMMAR,2,A list of _____ events will be posted on the noticeboard.,far-reaching,forthcoming,approaching,inevitable,B,"A. far-reaching /ˌfɑː ˈriːtʃɪŋ/ (a): có ảnh hưởng sâu rộng | B. forthcoming /ˌfɔːθˈkʌmɪŋ/ (a): sắp tới, sắp đến | C. approaching /əˈprəʊtʃ/ (V-ing): đến, tới | D. inevitable /ɪnˈevɪtəbl/ (a): không thể tránh được, quen thuộc. Tạm dịch: Một danh sách các sự kiện sắp tới sẽ được đăng trên bảng thông báo."
2ff80ab2-e46e-4c17-b529-0f6fa438fe06,27,GRAMMAR,2,"Aliza always raises her hands in her classroom and buys some presents for her teachers, which makes other students dislike her. She’s such a _____",teacher's toy,teacher's pet,teacher's apple,teacher's sweet,B,Cụm từ: be a teacher's pet: là học sinh cưng của giáo viên. Tạm dịch: Aliza luôn giơ tay trong lớp và mua quà cho những thầy cô khiến những học sinh khác không thích cô ấy. Cô ấy là học sinh cưng của giáo viên. Giaoandethitienganh.info
2ba14742-f517-40a8-b70f-4fc8a8885697,26,VOCAB,2,All countries in the world are under an obligation to _____ international regulations or else their economy and stature will be under threat.,adhere to,take to,catch up,comply to,A,"A. adhere to: tuân theo | B. take to: có cảm tình, thích ai | C. catch up: bắt kịp | D. comply to (không có cụm này) → comply with: tuân theo. Tạm dịch: Tất cả các quốc gia trên thế giới đều phải tuân theo những quy định quốc tế nếu không nền kinh tế và vị thế của họ sẽ bị đe dọa."
51378854-0db1-422b-bfc3-df519626a077,20,VOCAB,2,"_____ , all employees in my company are efficient and have good problem-solving skills.",Fair and square,Ins and outs,Odds and ends,By and large,D,"A. Fair and square: công bằng và thẳng thắn | B. Ins and outs: chi tiết và tính phức tạp của điều gì | C. Odds and ends: đầu thừa đuôi thẹo, vật linh tinh, không cần thiết | D. By and large: nhìn chung. Tạm dịch: Nhìn chung, tất cả nhân viên trong công ty của tôi đều làm việc hiệu quả và có kỹ năng giải quyết vấn đề tốt."
8dfa19ff-e91e-462b-9a6a-6181f8a5721d,6,VOCAB,2,All fossil fuels are ___________ resources that cannot be replaced after use.,unlimited,renewable,available,non-renewable,D,"A. unlimited /ʌnˈlɪmɪtɪd/(a): không giới hạn, vô tận | B. renewable /rɪˈnjuːəbl/(a): có thể tái tạo được | C. available /əˈveɪləbl/(a): có sẵn | D. non-renewable /ˌnɒnrɪˈnjuːəbl/(a): không tái tạo được. Tạm dịch: Tất cả nhiên liệu hóa thạch là những nguồn không thể tái tạo được, những cái không thể thay thế sau khi sử dụng."
7bf043f3-4f09-4f3e-97bf-7c1cf2d4fe7c,4,VOCAB,2,All nations should ___________ hands to work out a plan to solve the problem of global warming.,join,hold,shake,lend,A,"A. join hands (v): chung tay, hiệp lực, góp sức | B. hold hands (v): nắm tay (2 người yêu nhau) | C. shake hands (v): bắt tay | D. lend a hand = help (v): giúp đỡ. Tạm dịch: Tất cả các quốc gia nên chung tay lập ra một kế hoạch để giải quyết vấn đề nóng lên toàn cầu."
69fd6323-f149-40f1-903e-429e45592673,7,VOCAB,2,All the different plants and animals in a natural community are in a _________ of balance.,state,status,situation,position,A,A. state /steɪt/ (n): trạng thái | B. status /'steɪtəs/ (n): địa vị | C. situation /ˌsɪtʃu'eɪʃn/ (n): tình huống | D. position /pə'zɪʃn/ (n): vị trí. In a state of balance: ở trạng thái cân bằng. Tạm dịch: Tất cả các loài động thực vật khác nhau sống trong cùng một quần xã đang ở trong trạng thái cân bằng.
c698f7dc-b816-498f-bbc3-3f26e22a7b7b,13,GRAMMAR,2,All the three boys seem to fall ___________ over heels in love with her.,head,heart,mind,soul,A,"Cấu trúc: fall head over heels in love: si mê ai đó, yêu ai đó say đắm. Tạm dịch: Cả ba chàng trai dường như đều si mê cô ấy."
54f2cafd-65b0-4bb8-8a1a-632a20c38a4d,15,VOCAB,2,"“All work and no play makes Jack a dull boy” is a proverb which means that without time ___________ work, a person becomes both bored and boring.",on and on,off from,on and off,away from,B,A. on and on: liên tục | B. off from work: nghỉ làm | C. on and off: thất thường. Tạm dịch: Chỉ biết làm việc và không chơi bời khiến Jack trở thành cậu bé đần độn.
6cec323d-d917-41d1-bc38-c1c9056936cf,9,GRAMMAR,2,A lot of generous businessmen have ___________ valuable contributions to helping needy people.,done,taken,made,given,C,"Cấu trúc: make contributions to: đóng góp, ủng hộ. Tạm dịch: Nhiều doanh nhân hào phóng đã ủng hộ để giúp đỡ những người khó khăn."
186efe4e-72c4-4b18-afa8-1350acdb3fd9,3,VOCAB,2,A lot of people left their home villages for urban areas hoping to find jobs in the rapidly ___________ industries in big towns and cities.,spreading,expanding,surrounding,boarding,B,"A. spreading /spredɪŋ/(n): sự lan rộng | B. expanding /ɪkˈspændɪŋ/(n): sự mở rộng, phát triển | C. surrounding /səˈraʊndɪŋ/(a): phụ cận | D. boarding /ˈbɔːdɪŋ/(n): sự lên tàu. Tạm dịch: Rất nhiều người rời quê hương để đến các khu vực thành thị hi vọng sẽ tìm được công việc trong các ngành công nghiệp đang phát triển nhanh chóng."
4d5b9221-e90a-4a6b-8f63-21c4e1fcc918,16,VOCAB,2,Already there are encouraging signs that the rate of increase in many less developed countries is beginning to _____.,slow down,speed up,cool down,heat up,A,"A. slow down: giảm tốc độ, làm chậm lại | B. speed up: tăng tốc, làm nhanh lên | C. cool down: làm mát, trở nên bình tĩnh hơn | D. heat up: làm ấm, làm nóng. Tạm dịch: Đã có những dấu hiệu tích cực về tỉ lệ tăng dân số ở các nước kém phát triển đang bắt đầu giảm đi."
ea93836f-1ca7-4fd2-98eb-d37bda198c89,4,GRAMMAR,2,"Although climate changes have occurred on our planet before, these ___________ changes were different from the modern ones in that they occurred gradually and, as far as we know, naturally.",climate,climatology,climatic,climax,C,"A. climate /ˈklaɪmət/ (n): thời tiết | B. climatology /ˌklaɪməˈtɒlədʒi/ (n): khí hậu học | C. climatic /klaɪˈmætɪk/ (a): thuộc khí hậu, thuộc nhiệt đới | D. climax /ˈklaɪmæks/ (n): cao trào (văn chương). Cụm danh từ: climatic changes (n): những thay đổi về thời tiết. Tạm dịch: Mặc dù biến đổi khí hậu đã xảy ra trên hành tinh chúng ta trước đây rồi nhưng những thay đổi khí hậu này khác với những điều hiện đại do chúng xảy ra dần dần và theo như chúng ta biết thì chúng diễn ra một cách tự nhiên."
