macauhoi,topic,kynang,mucdo,noidung,A,B,C,D,dapandung,giaithich
9f8f844f-4b16-44f7-94e3-daa7800e67f0,27,VOCAB,2,"Harry must be very _____ to be able to complete an online ""teach yourself"" course.",self-aware,self-motivated,self-confident,self-conscious   Giaoandethitienganh.info,B,"A. self-aware /ˌself əˈweər/ (a): tự ý thức | B. self-motivated /ˌself ˈməʊtɪveɪtɪd/ (a): tự giác, năng nổ | C. self-confident /ˌself ˈkɒnfɪdənt/ (a): tự tin | D. self-conscious /ˌself ˈkɒnʃəs/ (a): ngại ngùng, e thẹn. Tạm dịch: Harry chắc là rất tự giác khi hoàn thành khóa học trực tuyến ""dạy chính mình""."
2a19a3bf-6c5a-41e5-a811-61884f7280b5,4,VOCAB,2,"Having read the report on how the burning of petrol in cars ___________ to climate change, we decided to sell our car and get a bicycle instead.",attributes,contributes,introduces,distributes,B,"A. attribute /ˈætrɪbjuːt/ (v): quy cho là | B. contribute /kənˈtrɪbjuːt/ (v): góp phần | C. introduce /ˌɪntrəˈdʒuːs/ (v): giới thiệu | D. distribute /dɪˈstrɪbjuːt/ (v): phân phối, phân phát. Tạm dịch: Khi đọc báo cáo về lượng xăng bị đốt cháy khi dùng xe hơi góp phần vào biến đổi khí hậu, chúng tôi quyết định bán xe của mình và dùng một chiếc xe đạp để thay thế."
db1cbd5d-6109-4b43-929d-b7264b048d4a,20,GRAMMAR,2,"Having revealed confidential documents to an agency’s competitor, Mr. Gordon would definitely be sued for _____ of contract.",crack,breach,rupture,fracture,B,"A. crack /kræk/ (v): quất (roi), búng (ngón tay)/làm nứt, rạn vỡ | B. breach /bri:tʃ/ (v): chọc thủng | C. rupture /'rʌptʃər/ (v): đoạn tuyệt, cắt đứt (một mối quan hệ) | D. fracture /'fræktʃər/ (v): bẻ gãy, rạn, nứt. Cấu trúc: breach of contract: sự vi phạm hợp đồng. Tạm dịch: Sau khi tiết lộ tài liệu mật cho một đối thủ cạnh tranh của cơ quan, ông Gordon chắc chắn sẽ bị kiện vì vi phạm hợp đồng."
8f360cc6-aa9b-4e98-a10a-64197b551c69,11,VOCAB,2,He behaved like an adult. I think he is more _________ than the other boys at his class.,intelligent,mature,ambitious,developed,B,A. intelligent /ɪn'telɪdʒənt/ (a): thông minh | B. mature /mə'tʃuər/ (a): trưởng thành | C. ambitious /æm'bɪʃəs/ (a): tham vọng | D. developed /dɪ'veləpt/ (a): phát triển. Tạm dịch: Anh ấy cư xử như một người trưởng thành. Tôi nghĩ anh ấy trưởng thành hơn những cậu bé ở lớp học của anh ấy.
9daeea0f-8f8e-4697-be45-68d02aa50b03,30,VOCAB,2,He _____ burnt himself when he added acid sulfuric into the water during his experiment in the school laboratory.,incongruously,inadvertently,vehemently,graciously,B,"A. incongruously /ɪnˈkɒŋɡruəsli/ (adv): không thích hợp, phi lí | B. inadvertently /ˌɪnədˈvɜːtntli/ (adv): tình cờ, không cố ý | C. vehemently /ˈviːəməntli/ (adv): mãnh liệt, kịch tính | D. graciously /ˈɡreɪʃəsli/ (adv): hòa nhã, ân cần. Tạm dịch: ông vô tình làm bỏng chính mình khi ông thêm axitsulfuric vào nước trong thí nghiệm ở phòng thí nghiệm của trường học"
093f7fdb-913a-452f-b715-9d5456d19114,11,VOCAB,2,"He felt a sense of incredulity, anger and pain at the _________ made against him.",judgement,improvement,progress,accusation,D,"A. Judgement /'dʒʌdʒmənt/ (n): sự đánh giá | B. Improvement /ɪm'pru:vmənt/ (n): sự cải thiện | C. Progress /'prəʊgres/ (n): sự tiến bộ | D. Accusation /,ækju'zeɪʃn/ (n): sự kết tội. Tạm dịch: Anh ấy đã cảm thấy nghi ngờ, tức giận và đau đớn với sự kết tội được tạo ra để chống lại anh ấy."
0ae6ec22-ec6b-4ecc-8b8f-73c4c7ed7752,13,GRAMMAR,2,He had been lied to and ___________ in the back by people that he thought were his friends.,knew,stabbed,gripped,tabbed,B,"Cấu trúc: Stab sb in the back: phản bội, đâm sau lưng ai đó. Tạm dịch: Anh ta đã bị lừa dối và đâm sau lưng bởi những người mà anh ta nghĩ là bạn."
5706c3d6-ef9f-4d47-8bde-7c4090fecad0,19,VOCAB,2,"He had devoted his life to the development of the district, so a _____ to him was erected in St Paul's Cathedral.",monument,gravestone,memorial,chamber,A,"A. monument /'mɒnjəmənt/ (n): đài kỉ niệm | B. gravestone/'greivstəʊn/ (n): bia mộ | C. memorial /mə'mɔ:riəl/ (a/n): thuộc kỷ niệm, vật kỉ niệm | D. chamber /'tʃeɪmbər/ (n): phòng ngủ, buồng ngủ. Tạm dịch: Anh ấy đã cống hiến cả cuộc đời cho sự phát triển của quận bởi vậy một đài kỉ niệm dành cho anh ấy đã được dựng lên tại nhà thờ lớn ở phố Paul."
93711e52-d084-45b4-9295-74fa96d9c1bb,6,VOCAB,2,He has ___________ extensive research into renewable energy sources.,carried out,turned on,taken over,cared for,A,"A. carried out: tiến hành | B. turned on: bật | C. taken over: tiếp quản, chiếm đoạt | D. cared for: bảo vệ, thích. Tạm dịch: Anh ấy đã tiến hành nhiều nghiên cứu về những nguồn năng lượng có thể tái tạo được."
8dfff07b-e97a-4073-97f6-5e93c40a27fa,11,VOCAB,2,He _________ her comments as an implicit criticism of the government.,interpreted,translated,figured,distinguish,A,A. interpret /ɪn'tɜ:prɪt/ (v): hiểu | B. translate /trænz'leɪt/ (v): dịch | C. figure /'fɪgər/ (v): tính toán | D. distinguish /dɪ'stɪŋgwɪʃ/ (v): phân biệt. Tạm dịch: Anh ấy đã hiểu lời nhận xét của cô ấy như là một lời chỉ trích ngầm chính phủ.
1fe01f75-84c9-46ea-87ca-7391c32506e9,15,GRAMMAR,2,He ___________ himself in gambling and ended his future in debt.,prided,engaged,invested,indulged,D,"A. pride (v): tự hào | B. engage (v): tham gia | D. indulge /ɪn'dʌldʒ/ (v): ham mê, dấn thân vào. Cấu trúc: Indulge oneself in (with) st: ham mê, say mê. Tạm dịch: Anh ta ham mê cờ bạc và kết thúc tương lai của mình trong nợ nần."
5df3fe79-4aaf-4fca-9fef-2e30199977dd,19,GRAMMAR,2,He is scheduled to observe work Saturday at the _____ site of an America jet-fighter which crashed in 1967 near Hanoi. _____,excavation,excavate,excavator,excavated,A,"A. excavation /ekska'veɪʃən/ (n): sự khai quật | B. excavate /ekskə'veɪt/ (v): khai quật | C. excavator /'ekskəveɪtər/ (n): nhà khai quật, máy xúc | D. excavated /'ekskəveɪtɪd/ (v-ed): khai quật. Tạm dịch: Anh ta được lên lịch là giám sát công việc vào ngày thứ bảy tại điểm khai quật một máy bay chiến đấu phản lực của Mĩ cái mà đã rơi xuống vào năm 1967 gần Hà Nội."
9938cc8c-306f-4c87-b5fd-66807c48ba16,2,VOCAB,2,Helen’s parents were very pleased when they read her school ___________.,papers,report,diploma,account,B,A. papers /ˈpeɪpə(r)/(n): giấy | B. report /rɪˈpɔːt/ (n): bản thông báo | C. diploma /dɪˈpləʊmə/(n): bằng tốt nghiệp | D. account /əˈkaʊnt/(n): tài khoản. Cụm từ: school report: sổ liên lạc. Tạm dịch: Bố mẹ Helen rất hài lòng khi họ đọc sổ liên lạc của cô ấy.
6a90c481-cfef-4d6f-b409-2f71a51ec1e7,14,VOCAB,2,He practically ___________ a comic style called stand-up comedy in which a comedian performs in front of a live audience.,realized,invented,distributed,thought,B,"A. realize (v): nhận ra | B. invent /ɪn'vent/ (v): phát minh | C. distribute (v): phân phát | D. think (v): suy nghĩ. Tạm dịch: Anh ấy đã phát minh ra một thể loại hài kịch mới, được gọi là hài độc thoại."
967716d0-12e2-4aa4-9147-89c5e7bb26d3,12,GRAMMAR,2,Her husband is very kind. He always cares ___________ her and never puts all of the housework ___________ her.,about - in,for - in,about - on,with - on,C,Cấu trúc: Care about sb: quan tâm tới ai; Put st on sb: đùn đẩy hết cái gì cho ai. Tạm dịch: Chồng của cô ấy rất tốt bụng. Anh ấy luôn luôn quan tâm cô ấy và không bao giờ đùn đẩy hết việc nhà cho cô ấy.
90b25f3b-e504-4b84-b9f0-fa7d0ae29423,23,VOCAB,2,"_____ her shyness and being an introvert, her failure to make friends with other peers at school was not surprising.",By virtue of,With regard to,In view of,In recognition of,A,"A. by virtue of: bởi vì | B. with regard to: xem xét | C. in view of: xét về | D. in recognition of: công nhận. Tạm dịch: Bởi vì cô ấy rụt rè và là người sống hướng nội, việc cô ấy không thể kết bạn với những người bạn khác ở trường không có gì ngạc nhiên."
5a84f421-02e2-4b5a-a812-c42927a49c4e,27,VOCAB,2,He's decided to _____ his Spanish by attending an evening course before he meets his business partners at the end of this year.,patch up,brush up,polish off,dust off,B,A. patch up: vá víu | B. brush up: ôn lại | C. polish off: làm xong gấp (công việc) | D. dust off: mang ra dùng. Tạm dịch: Anh ấy quyết định ôn lại tiếng Tây Ban Nha bằng việc tham gia vào một khóa học buổi tối trước khi anh ấy gặp đối tác kinh doanh vào cuối năm nay.
fe4547e9-4f15-4074-9a61-891ebca50e85,10,VOCAB,2,He sent his children to the park so that he could have some ___________.,fresh and quiet,quiet and peace,peace and quiet,fresh and peace,C,C. peace and quiet: bình yên. Tạm dịch: Anh ta đưa con mình đến công viên để anh ta có thể tận hưởng một chút bình yên.
47bf372f-b6b4-4a39-a873-815f05045519,30,VOCAB,2,"He _____ subscribed to the ""theory"" that the Earth is flat and in the center of the solar system, which has been proved to be antiscientific for long time ago.",soft-heartedly,half-heartedly,light-heartedly,whole-heartedly,D,"A. soft-heartedly /ˌsɒft ˈhɑːtɪdli/ (adv): một cách tốt bụng, cảm thông | B. half-heartedly /ˌhɑːf ˈhɑːtɪdli/ (adv): một cách vô cảm, hời hợt | C. light-heartedly /ˌlaɪt ˈhɑːtɪdli/ (adv): một cách vô tư, hạnh phúc | D. whole-heartedly /ˌhəʊlˈhɑːtɪdli/ (adv): một cách toàn tâm toàn ý, hết lòng hết dạ. Tạm dịch: Anh ta hoàn toàn tán thành giả thuyết cho rằng Trái Đất phẳng và là trung tâm của hệ Mặt Trời cái mà đã được chứng minh là phản khoa học từ rất lâu."
e697914e-c3c5-486b-81d6-d7ebfc0365e8,15,GRAMMAR,2,He ___________ us for hours with his stories and jokes.,supported,entertained,regarded,raised,B,"A. supported (v-ed): ủng hộ | B. entertained /entə'teɪnd/ (v-ed): giải trí, khôi hài. Tạm dịch: Anh ta mua vui cho chúng tôi hằng giờ với những câu chuyện và trò cười của anh ta."
13336835-9cb7-46eb-8f87-a32194fb865a,26,VOCAB,2,He was carried off the field with a slight _____ arising from sports.,concussion,damage,harm,adversities,A,"A. concussion /kənˈkʌʃn/ (n): sự rung chuyển, sự chấn động | B. damage /ˈdæmɪdʒ/ (n): thiệt hại | C. harm /hɑːm/ (n): điều tai hại | D. adversities /ədˈvɜːsəti/ (n): điều bất lợi, nghịch cảnh. Tạm dịch: Anh ấy đã được đưa ra khỏi sân do chấn động nhẹ khi chơi thể thao."
563ba19f-5f23-4897-8ad4-41030075d25f,4,GRAMMAR,2,He was suspected ___________ having received presents from the local companies and ignored their violations of the environmental law.,about,on,of,for,C,Cấu trúc: suspect sb of st/doing st: nghi ngờ ai phạm tội gì đó. Tạm dịch: Anh ta bị nghi ngờ đã nhận quà hối lộ từ công ty tại địa phương và làm ngơ trước sự vi phạm về luật môi trường của họ.
ce1ce6bb-aaa1-4efc-a045-73e1864f01bf,2,VOCAB,2,"Higher education is very important to national economies, and it is also a source of trained and ___________ personnel for the whole country.",educated,educational,educative,uneducated,A,"A. educated /ˈedʒukeɪtɪd/ (a): có học thức | B. educational /ˌedʒuˈkeɪʃənl/ (a): thuộc về giáo dục, có tính giáo dục | C. educative /ˈedʒukətɪv/ (a): có tác dụng giáo dục | D. uneducated /ʌnˈedʒukeɪtɪd/ (a): vô giáo dục, không được giáo dục. Tạm dịch: Giáo dục đại học rất quan trọng đối với nền kinh tế quốc gia, và đây cũng là một nguồn nhân lực được đào tạo và giáo dục cho cả nước."
dc7502db-5477-44d5-84d5-35ddc9988fd3,18,GRAMMAR,2,High intelligent machines can be automated to operate without human _____.,intervene,intervening,intervention,interventionist,C,"A. intervene /,ɪntə'vi:n/ (v): xen vào, can thiệp | B. intervening /ˌɪntəˈviːnɪŋ/ (adj): giữa, trung gian | C. intervention /ˌɪntəˈvenʃn/ (n): sự can thiệp, sự xen vào | D. interventionist /ˌɪntəˈvenʃənɪst/ (v): người can thiệp. Tạm dịch: Máy móc thông minh cao có thể được tự động để hoạt động mà không cần đến sự can thiệp của con người."
c63da529-175a-44f4-9d3f-5aadd952ccd2,11,GRAMMAR,2,His father used to be a _________ professor at the university. Many students worshipped him.,distinct,distinctive,distinguishing,distinguished,D,A. distinct /dɪ'stɪŋkt/ (a): khác biệt | B. distinctive /dɪ'stɪŋktɪv/ (a): đặc biệt | C. distinguishing /dɪ'stɪŋgwɪʃɪŋ/ (a): khác biệt | D. distinguished /dɪ'stɪŋgwɪʃt/ (a): nổi tiếng. Tạm dịch: Bố anh ấy đã từng là một giáo sư nổi tiếng ở trường đại học. Nhiều sinh viên tôn thờ ông ấy.
6ef31fe3-8bbd-4d18-862a-0aa2402a6abc,29,VOCAB,2,"His flight was in _____ around the Earth at the speed of more than 17,000 miles per hour.",orbit,travel,circuit,revolve,A,Cụm từ: in orbit: trong quỹ đạo. Tạm dịch: Chuyến bay của ông ấy trong quỹ đạo quay quanh trái đất ở tốc độ hơn 17000 dặm một giờ.
f0d2aec1-de70-4231-b7c2-6dab2d535d5f,28,VOCAB,2,Holding a warm-up activity was good for me _____ I gained a lot of valuable experience.,as far as,in that,as for,in terms of,B,"A. as far as: theo như | B. in that: bởi vì | C. as for: về phần | D. in terms of: về phần, về phía, xét về mặt. Tạm dịch: Tổ chức một hoạt động khởi động là tốt cho tôi, bởi vì tôi đã thu được rất nhiều kinh nghiệm quý giá."
96327baf-17c2-48ce-bad5-96f09382f10a,21,VOCAB,2,"Homes and buildings will operate as living organisms, monitoring performance _____ and _____ to our needs in real time, saving US energy and money.",adapted,to adapt,adapting,adapt,C,"Tạm dịch: Các ngôi nhà và tòa nhà sẽ hoạt động như những sinh vật sống, theo dõi hiệu suất và thích ứng với nhu cầu của chúng ta trong thời gian thực, giúp chúng ta tiết kiệm năng lượng và tiền bạc."
44e06d08-b3da-4fb2-b506-bf47e02fb4c8,15,VOCAB,2,"Hotels, airlines and other firms in the leisure ___________ may suffer from economic crisis.",enterprise,agencies,corporation,industry,D,"A. enterprise (n): sự nghiệp | D. industry /'ɪndəstri/ (n): công nghiệp. Tạm dịch: Những khách sạn, dịch vụ hàng không và các công ty khác trong ngành công nghiệp giải trí có lẽ phải chịu khủng hoảng kinh tế."
1fc12000-f514-4609-a788-c6bb9b9a7044,3,VOCAB,2,"However, urbanization has also resulted in massive problems.",numerous,huge,plentiful,abundant,A,"A. numerous /ˈnjuːmərəs/(a): nhiều, đông đảo | B. huge (a): to lớn, khổng lồ | C. plentiful (a): sung túc, dồi dào. Tạm dịch: Tuy nhiên, sự đô thị hóa cũng dẫn đến rất nhiều vấn đề."
13ad8baa-a452-423b-a5b6-9fd4c1bf5f44,2,VOCAB,2,"“How was your exam?” “A couple of questions were tricky, but on the ___________ it was pretty easy.”",spot,general,hand,whole,D,"A. on the spot: ngay lập tức | B. in general: nói chung, nhìn chung | C. on hand: sẵn sàng, sẵn có | D. on the whole: nhìn chung là. Tạm dịch: “Bài kiểm tra hôm qua của cậu như thế nào?” - “Có một vài câu đánh đố nhưng nhìn chung thì khá là dễ.”"
3de36293-d764-4dbd-9941-7b2c3f66d151,29,VOCAB,2,How would the body react to the _____ changes in temperature?,severe,sudden,extreme,rapid,B,"A. severe /sɪˈvɪər/ (a): khắt khe, gay gắt | B. sudden /ˈsʌdən/ (a): bất ngờ, đột ngột | C. extreme /ɪkˈstriːm/ (a): vô cùng, cực độ | D. rapid /ˈræpɪd/ (a): nhanh. Tạm dịch: Làm thế nào mà cơ thể phản ứng được với những thay đổi đột ngột về nhiệt độ?"
27822523-5cb2-484e-8161-7b4e819ff84d,25,VOCAB,2,I always get the news from my local radio _____,place,site,studio,station,D,A. place /pleɪs/ (n): địa điểm | B. site /saɪt/ (n): trang mạng | C. studio /ˈstjuːdiəʊ/ (n): phòng thu | D. station /ˈsteɪʃn/ (n): trạm. Tạm dịch: Tôi luôn nghe tin tức từ đại phát thanh địa phương.
84d7bfb9-fcd9-490b-901d-2703e8efd852,13,GRAMMAR,2,"I believe that faithful friend can brighten your life and make it more interesting, ___________ and enjoyable.",vividity,vivid,vividly,vividness,B,"A. vividity (n): tính sinh động | B. vivid /'vɪvɪd/ (a): sống động | C. vividly (adv): một cách mạnh mẽ | D. vividness (n): tính sinh động. Cần tính từ đứng sau 'interesting'. Tạm dịch: Tôi tin rằng người bạn trung thành có thể làm cuộc sống của bạn trở nên tươi vui, thú vị và sống động hơn."
b72d3a63-c4e7-427a-aca1-893a9b4b997c,19,GRAMMAR,2,"Iceland is full hot springs, beautifully colored rocks and other natural _____",wonder,wonders,wonderful,wonderment,B,"A. wonder /'wʌndər/ (n): kì quan | B. wonders /'wʌndərz/ (n): những kì quan | C. wonderful /'wʌndəfəl/ (a): tuyệt vời | D. wonderment /'wʌndəmənt/ (n): sự ngạc nhiên. Tạm dịch: Iceland có những mùa xuân tràn ngập ấm áp, những dãy đá màu sắc tuyệt đẹp và những kì quan thiên nhiên khác."
8afc6cd9-4225-42b7-819f-7d02cb0c67c0,23,GRAMMAR,2,I couldn't believe it when Fiona accused me of _____ only had a normal conversation with him at my office. in her relationship with Jack. I,intervening,interfering,intercede,intersect,B,A. intervening /ˌɪntəˈviːnɪŋ/ (v-ing): can thiệp (để cải thiện tình hình) | B. interfering /ˌɪntəˈfɪərɪŋ/ (v-ing): can thiệp (làm xấu đi) | C. intercede /ˌɪntəˈsiːd/ (v): đứng ra giải hòa | D. intersect /ˌɪntəˈsekt/ (v): phân cắt. Tạm dịch: Tôi không thế tin rằng Fiona buộc tội tôi xen vào mối quan hệ của cô ấy với Jack. Tôi chỉ nói chuyện bình thường với anh ta ở cơ quan mà thôi.
38af7484-f385-4ae9-9af7-f8a6af96d479,2,VOCAB,2,"I did six hours of ___________ for the test, but I still failed.",education,survey,revision,training,C,"A. education /ˌedʒuˈkeɪʃn/ (n): giáo dục | B. survey /ˈsɜːveɪ/ (n): cuộc điều tra | C. revision /rɪˈvɪʒn/ (n): sự ôn tập | D. training /ˈtreɪnɪŋ/ (n): sự đào tạo, huấn luyện. Cụm từ: do a revision = revise (v): ôn tập. Tạm dịch: Tôi đã ôn tập suốt 6 giờ cho bài kiểm tra nhưng tôi vẫn thất bại."
9a716725-e638-48ed-b96a-17a6454d0cca,26,VOCAB,2,I'd like to put forward the idea that sports salaries should be _____ with the wages most people earn.,appropriate,adaptable,suitable,compatible,D,"A. appropriate /əˈprəʊpriət/ (a): phù hợp | B. adaptable /əˈdæptəbl/ (a): có thể thích nghi | C. suitable /ˈsuːtəbl/ (a): thích hợp | D. compatible /kəmˈpætəbl/ (a): hợp nhau, tương thích. Tạm dịch: Tôi đưa ra ý kiến rằng lương thể thao nên tương đương với lương mà đa số mọi người kiếm được."
e5dd6fb2-0db8-4df1-9233-663450f71117,20,GRAMMAR,2,I don’t know how an office worker can sit in front of a computer for hours _____ end.,for,by,at,on,D,"Cấu trúc: for hours on end: (liên tục) nhiều giờ, hàng giờ liền. Tạm dịch: Tôi không biết làm thể nào một nhân viên văn phòng có thể ngồi trước máy tính hàng giờ liền."
99dd0cb7-56d5-4f3d-a783-946341b8ba7a,18,GRAMMAR,2,"If _____ and artificial intelligence in the workplace become a reality, there will surely be an increasing need for skills that robots can't offer.",automatic,automate,automation,automatically,C,"A. automatic /ˌɔːtəˈmætɪk/ (a): tự động | B. automate /ˈɔːtəmeɪt/ (v): tự động hóa | C. automation /ˌɔːtəˈmeɪʃn/ (n): sự tự động hóa | D. automatically /ˌɔːtəˈmætɪkli/ (adv): một cách tự động Khi có từ “and"" thì 2 vế sẽ có cùng chức năng từ loại. Do đó, vị trí trống cần một danh từ nên đáp án là | C. Tạm dịch: Nếu việc tự động hóa và trí tuệ nhân tạo tại nơi làm việc trở thành hiện thực, chắc chắn sẽ có nhu cầu ngày càng cao về các kỹ năng mà robot không thể cung cấp."
1d710f67-ba1e-4493-912d-4e762594b96e,26,GRAMMAR,2,"If each developmental stage is fully formed, active children have the ability to completely reach their maximum _____ for participation in sports.",capacity,capacitate,capacitation,capacitance,A,"A. capacity /kəˈpæsəti/ (n): sức chứa, công suất | B. capacitate /kəˈpæsɪteɪt/ (v): làm cho có thể | D. capacitance /kəˈpæsɪtəns/ (n): điện dung capacity for something: khả năng tạo ra, trải qua, hiểu, học cái gì. Tạm dịch: Nếu mỗi giai đoạn phát triển được hình thành đầy đủ, trẻ em năng động có khả năng hoàn toàn đạt được khả năng tối đa để tham gia thể thao."
7e901bf2-c68c-4ba4-bec3-e44cfddd2820,8,VOCAB,2,"If government don’t ___________ global warming, more natural disasters will occur.",achieve,promote,discourage,prevent,D,"A. achieve /əˈtʃiːv/ (v): đạt được | B. promote /prəˈməʊt/ (v): thúc đẩy | C. discourage /dɪˈskʌrɪdʒ/ (v): khuyến khích | D. prevent /prɪˈvent/ (v): ngăn chặn. Tạm dịch: Nếu chính phủ không ngăn chặn sự nóng lên toàn cầu, các thảm họa thiên nhiên sẽ xảy ra nhiều hơn."
db62c7a4-a997-4053-aaf0-770b934fa725,9,VOCAB,2,"If one wants to take part in volunteer organizations such as Green Summer Camp, Green Saturday Movement, Blood Donor..., he/she will have to ___________ an application form.",fill in,find out,log on,send off,A,"A. fill in: điền vào. Tạm dịch: Nếu muốn tham gia các tổ chức tình nguyện, anh/cô ấy phải điền vào mẫu đơn xin gia nhập."
e53e3726-9b63-44bf-b579-32a0b3e51322,15,VOCAB,2,"If you ___________ a book, you have a brief look at it without reading or studying it seriously.",dip into,put away,pick up,put down,A,"A. dip into: đọc qua vài trang | B. put away: dọn dẹp | C. pick up: nhặt được gì đó | D. put down: đặt xuống. Tạm dịch: Nếu bạn đọc qua một vài trang của một quyển sách, bạn sẽ có cái nhìn vắn tắt về nó mà không cần đọc hay nghiên cứu kĩ càng."
fe1999b4-5d82-4bf2-ae2a-f5a82df4f997,10,GRAMMAR,2,"If you are tired, even if you feel that you need to get more done, give yourself ___________ to sleep.",request,requirement,permission,permit,C,"A. request /rɪˈkwest/ (v): yêu cầu | B. requirement /rɪˈkwaɪəmənt/ (n): sự yêu cầu | C. permission /pəˈmɪʃən/ (n): sự cho phép | D. permit /ˈpɜːmɪt/ (v): cho phép. Cấu trúc: give sb permission to do st: cho phép ai làm gì. Tạm dịch: Nếu bạn cảm thấy mệt, ngay cả khi bạn cảm thấy cần làm nhiều việc, hãy cho phép bản thân mình được đi ngủ."
201261c6-f75d-44b4-8f3b-85036332012d,7,VOCAB,2,"If you buy souvenirs made from _________ animals or plants, you might contribute to making them become extinct.",endangered,danger,endanger,dangerous,A,"A. endangered /ɪn'deɪndʒəd/ (a): bị nguy hiểm | B. danger /'deɪndʒər/ (n): sự nguy hiểm | C. endanger /ɪn'deɪndʒər/ (v): gây nguy hiểm | D. dangerous /'deɪndʒərəs/ (a): nguy hiểm. Tạm dịch: Nếu bạn mua những món quà lưu niệm làm từ những loài động thực vật bị nguy hiểm, bạn đang góp phần đẩy chúng đến bờ vực tuyệt chủng."
d2fef22b-06d1-4c4c-b224-780b56858f09,10,GRAMMAR,2,"If you catch a cold, you should try natural ___________ before taking any medicine.",medicines,remedies,foods,ways,B,"A. medicine /ˈmedɪsən/ (n): thuốc | B. remedy /ˈremədi/ (n): phương thuốc | C. food /fuːd/ (n): thức ăn | D. way /weɪ/ (n): đường đi. Cấu trúc: catch a cold: bị cảm. Tạm dịch: Nếu bạn bị cảm, bạn nên thử những phương thuốc tự nhiên trước khi dùng thuốc tây."
81247fac-7ff4-41af-8b01-1cc3cc6c562c,15,VOCAB,2,"If you do very little reading or if you read only material that offers no ___________ to your comprehension, your reading will be of very little use.",challenge,challenging,difficult,complex,A,"A. challenge /'tʃælɪndʒ/ (n/v): sự thách thức. Tạm dịch: Nếu bạn hầu như không đọc hoặc chỉ đọc những tài liệu không đem lại sự thách thức cho khả năng hiểu biết, việc đọc của bạn sẽ hầu như không có giá trị."
