macauhoi,topic,kynang,mucdo,noidung,A,B,C,D,dapandung,giaithich
f10c003f-eba6-4564-9f95-68541bb386a5,13,GRAMMAR,2,The company stopped using certain chemicals only after some workers ___________ the whistle on it.,blew,threw,flew,chew,A,"A. blew /blu:/ (v): thổi. Cấu trúc: blow the whistle on st/sb: tố cáo ai, việc gì để ngăn chặn điều xấu. Tạm dịch: Công ty đã ngừng sử dụng một số loại hóa chất sau khi một số công nhân tố cáo sự việc với cơ quan chức năng."
47e64a7a-3931-4dda-ad1a-5d7f0e5aa6fc,28,VOCAB,2,The competition he set up for young musicians is another _____ of his life-long support for the arts.,exposition,manifestation,token,exhibition,B,"A. exposition /ˌekspəˈzɪʃn/ (n): sự phơi bày | B. manifestation /ˌmænɪfeˈsteɪʃn/ (n): sự biểu lộ, biểu thị (là đại diện thay cho 1 điều gì đó) | C. token /ˈtəʊkən/ (n): dấu hiệu, biểu hiện (là ví dụ của 1 điều gì đó) | D. exhibition /ˌeksɪˈbɪʃn/ (n): sự trưng bày, cuộc triển lãm. Tạm dịch: Cuộc thi mà anh ấy mở ra cho các nhạc sĩ trẻ là một biểu hiện khác của sự ủng hộ trọn đời của anh ấy cho nghệ thuật."
73cf5860-e163-4c87-9d77-4b30bdfb615d,21,VOCAB,2,The computer allows US to work fast and _____,efficiently,differently,variously,freshly,A,A. efficiently /ɪˈfɪʃntli/ (adv): hiệu quả | B. differently /ˈdɪfrəntli/ (adv): khác biệt | C. variously /ˈveəriəsli/ (adv): khác nhau theo từng trường hợp | D. freshly /ˈfreʃli/ (adv): tươi mới. Tạm dịch: Máy tính cho phép chúng ta làm việc nhanh chóng và hiệu quả.
a5d9bdb5-f664-49b3-b908-dc0487ffe708,10,VOCAB,2,"The controller of the body is the ___________ system. Led by the brain and nerves, it allows us to move, talk and feel emotions.",circulatory,digestive,nervous,respiratory,C,"A. circulatory /ˌsɜːkjəˈleɪtəri/ (a): (thuộc) sự tuần hoàn máu | B. digestive /daɪˈdʒestɪv/ (a): tiêu hóa | C. nervous /ˈnɜːvəs/ (n): thần kinh | D. respiratory /rɪˈspɪrətəri/ (a): (thuộc) hô hấp. Tạm dịch: Cơ quan điều khiển toàn bộ cơ thể là hệ thần kinh. Được dẫn dắt bởi não và các dây thần kinh, nó làm cho ta di chuyển, nói chuyện và có cảm xúc."
c05aa6ba-c68a-42c6-8ec0-2ded113021e5,8,VOCAB,2,The council wants to ___________ the character of the city while reconstructing the Old Quarter.,preserve,store,defense,abandon,A,A. preserve /prɪˈzɜːv/ (v): bảo tồn | B. store /stɔː(r)/ (v): lưu trữ | C. defense /dɪˈfens/ (v): chống lại | D. abandon /əˈbændən/ (v): bỏ rơi. Tạm dịch: Hội đồng muốn bảo tồn nét đặc trưng cho thành phố trong việc xây dựng lại khu phố cổ.
d048cf5f-d366-4fc8-99f3-2d656cbcc950,4,VOCAB,2,The country’s entire grain harvest has been hit by a __________.,brought,fought,drought,sought,C,A. brought: động từ hình thái Ved của bring | B. fought: động từ hình thái Ved của fight | C. drought /draʊt/ (n): hạn hán | D. sought: động từ hình thái Ved của seek. Tạm dịch: Toàn bộ vụ lúa trong cả nước mất trắng sau một cơn hạn hán.
3dc6791c-e98b-4030-88b8-bc899987a50e,29,GRAMMAR,2,The craft _____ the moon ten times and sent television pictures of its surface back to Earth.,circled,rounded,surrounded,orbited,D,A. circled /ˈsɜːkəld/ (v-ed): xoay quanh | B. rounded /ˈraʊndɪd/ (v-ed): quay tròn | C. surrounded /səˈraʊndɪd/ (v-ed): bao quanh | D. orbited /ˈɔːbɪtɪd/ v-ed): di chuyển theo quỹ đạo quanh cái gì. Tạm dịch: Máy bay đã di chuyến theo quỹ đạo quanh Mặt Trăng mười lần và gửi tín hiệu hình ảnh bề mặt của nó tời trái đất.
23a92d54-0b04-4f2a-a5b6-26f09ac4326e,1,VOCAB,2,"The custom of _________ ancestors is a beautiful, rich, and colorful and joyful tradition in Vietnamese culture.",praying,honoring,respecting,worshiping,D,"A. pray /preɪ/ (v): cầu nguyện | B. honor /ˈɒnər/ (v): kính trọng | C. respect /rɪˈspekt/ (v): tôn trọng | D. worship /ˈwɜːʃɪp/ (v): thờ cúng. Tạm dịch: Phong tục thờ cúng tổ tiên là một truyền thống đẹp, giàu ý nghĩa của văn hóa Việt Nam."
f7ceef7f-1e00-47d4-a2f6-ab71615e6920,1,VOCAB,2,The custom of paying a bride price before marriage is still a _________ part of many African cultures.,well-established,well-advised,well-built,well-balanced,A,"A. well-established /ˌwel ɪˈstæblɪʃt/ (a): bền vững | B. well-advised /ˌwel ədˈvaɪzd/ (a): khôn ngoan, cẩn trọng | C. well-built /ˌwel ˈbɪlt/ (a): vạm vỡ | D. well-balanced /ˌwel ˈbælənst/ (a): cân bằng. Tạm dịch: Phong tục trả giá cô dâu trước khi cưới vẫn là một phần cố hữu trong văn hóa của các nước châu Phi."
ffe3607c-e834-45ee-a232-31b772549c76,3,VOCAB,2,The economic ___________ in the U.S in the 1970s had a serious impact on the whole world.,difficulty,crisis,unbalance,destruction,B,A. difficulty (n): khó khăn | B. crisis /ˈkraɪsɪs/(n): cuộc khủng hoảng | C. unbalance (n): sự mất cân bằng. Tạm dịch: Cuộc khủng hoảng kinh tế ở Hoa Kỳ vào những năm 1970 đã gây tác động nghiêm trọng lên toàn thế giới.
41311b9f-9b02-4874-b3c8-dd2226443027,17,GRAMMAR,2,The efforts for the advancement of women have resulted _____ several respectively achievement in women's life and work.,at,with,for,in,D,Cấu trúc: result in st: dẫn tới điều gì. Tạm dịch: Những nỗ lực nâng cao quyền phụ nữ đã dẫn tới nhiều thành tựu lần lượt trong cuộc sống và công việc của phụ nữ.
7573c7ed-6a64-48ab-8671-14ef18c30ea9,23,VOCAB,2,The entire world is developing at an unprecedented rate. If you don't self-learn and cultivate communicative skills continuously you will _____ definitely not social movements.,deal with,get on with,keep up with,put up with,C,"A. deal with: xử lí | B. get on with: hòa hợp với | C. keep up with: theo kịp | D. put up with: chịu đựng. Tạm dịch: Toàn thế giới đang phát triển ở mức độ chưa từng thấy. Nếu bạn không tự học và phát triển khả năng giao tiếp một cách liên tục, bạn chắc chắn sẽ không theo kịp những chuyển biến của xã hội."
44f93fd3-3374-4fd5-bd75-881ef9e41adb,29,VOCAB,2,The existence of many stars in the sky _____ us to suspect that there may be life on another planet.,lead,leading,have led,leads,D,"Chủ ngữ là ""The existence” nên động từ chia số ít. Tạm dịch: Sự tồn tại của muôn vì sao trên bầu trời đã khiến chúng ta nghi ngờ rằng có sự sống ở một hành tinh khác."
9b41bd69-72c9-43f8-a9a8-b27833420e82,29,VOCAB,2,The exploration of Mars is being carried out by means of _____,satellites,shuttle,plane,spacecraft,A,A. satellites /ˈsætəlaɪt/ (n): vệ tinh | B. shuttle /ˈʃʌtəl/ (n): tàu con thoi | C. plane /pleɪn/ (n): máy bay | D. spacecraft /ˈspeɪskrɑːft/ (n): tàu vũ trụ. Tạm dịch: Việc khám phá Sao Hỏa đang được tiến hành bằng các vệ tinh.
98f40cbd-6354-4679-915c-a0c333253da7,14,VOCAB,2,The film contains of explicit ___________ of violence.,scenes,scents,sceneries,screens,A,A. scene /si:n/ (n): cảnh | B. scent (n): mùi hương | C. scenery /'si:nəri/ (n): phong cảnh | D. screen (n): màn ảnh. Tạm dịch: Bộ phim này chứa rất nhiều cảnh bạo lực.
928ec402-2546-4673-ab04-2d8c0a77a5b0,11,VOCAB,2,The film was so successful that the main actor became a _________ name afterwards.,housework,household,homework,housewife,B,A. housework /'hauswɜ:k/ (n): việc nhà | B. household /'haushəuld/ (n): hộ gia đình | C. homework /'həumwɜ:k/ (n): bài tập về nhà | D. housewife /'hauswaif/ (n): bà nội trợ. Ta có cụm từ: household name nghĩa là người nổi tiếng mà ai cũng biết. Tạm dịch: Bộ phim đó đã thành công tới mức mà nam diễn viên chính đã trở thành một người nổi tiếng sau đó.
225f13c1-86fa-40fb-915a-d4f147b44e05,24,GRAMMAR,2,The firefighters’ single-minded devotion to the rescue of the victims of the fire _____ was _____,respecting,respective,respectful,respectable,D,"A. respecting /rɪˈspektɪŋ/ (v-ing): tôn trọng | B. respective /rɪˈspektɪv/ (a): lần lượt, tương ứng | C. respectful /rɪˈspektfl/ (a): lễ phép | D. respectable /rɪˈspektəbəl/ (a): đáng kính trọng. Tạm dịch: Sự cống hiến tận tâm của những người lính cứu hỏa trong việc giải cứu những nạn nhân của vụ hỏa hoạn là đáng được kính trọng."
022ce8cf-d43b-49fb-a0fe-e94982154b62,24,VOCAB,2,The Food and Agriculture Organization (FAO) _____ that leads international efforts to defeat hunger.,it is a specialized agency in the United Nations,as it is a specialized agency by the United Nations,is a specialized agency of the United Nations,a specialized agency of the United Nations,C,A. it is a specialized agency in the United Nations: nó là một cơ quan chuyên môn tại Liên Hợp Quốc | B. it is a specialized agency by the United Nations: nó là một cơ quan chuyên môn bởi Liên Hợp Quốc | C. is a specialized agency of the United Nations: nó là một cơ quan chuyên môn của Liên Hợp Quốc | D. a specialized agency of the United Nations: một cơ quan chuyên môn của Liên hợp quốc. Tạm dịch: Tổ chức Lương thực và Nông nghiệp (FAO) là một cơ quan chuyên môn của Liên hợp quốc dẫn đầu các nỗ lực quốc tế để đánh bại nạn đói.
7ac32f0f-a4bd-4f99-8a09-213caf26aeda,19,VOCAB,2,"The four sides of the pyramid are aligned almost _____ on true north, south, east, and west - an incredible engineering feat.",truly,actually,positively,exactly,D,"A. truly /'tru:li/ (adv): đúng (nhấn mạnh cái gì đó là đúng) | B. actually /ˈæktʃuəli/ (adv): thực sự (nhấn mạnh cái gì xảy ra trên thực tế) | C. positively /ˈpɒzətɪvli/ (adv): cực kỳ, hết sức, tuyệt đối (nhấn mạnh tính đúng đắn của tuyên bố | D. exactly /ɪɡˈzæktli/ (adv): chính xác. Tạm dịch: Bốn mặt của Kim Tự tháp được sắp xếp thẳng hàng gần như chính xác cả ở bốn hướng Bắc, Nam, Tây, Đông - một công trình xây dựng không thể tin được."
5e3b7e51-9619-40f4-a308-cb52131e3d1d,17,GRAMMAR,2,"The gender gap has been remarkably _____ and women enjoy many more opportunities to pursue their social careers and obtain success, contributing to national socio-economic development.",lessened,shortened,narrowed,worsened,C,"A. lessened /'lesənd/ (v-ed): làm giảm | B. shortened /'ʃɔ:tənd/ (v-ed): làm ngắn lại | C. narrowed /'nærəʊd/ (v-ed): thu hẹp lại | D. worsened /'wɜː.sənd/ (v-ed): làm cho tệ hơn, xấu đi. Cụm từ: narrow gap: thu hẹp khoảng cách thế hệ. Tạm dịch: Khoảng cách giới tính đã được thu hẹp đáng kể và phụ nữ có nhiều cơ hội hơn để theo đuổi sự nghiệp của họ và đạt được thành công, điều này đóng góp đáng kể tới sự phát triển kinh tế xã hội của quốc gia."
7b980f45-5904-42aa-855a-656099f65911,4,VOCAB,2,"The goal of mitigation is to avoid dangerous human ___________ with the climate system, and stabilize greenhouse gas levels in a timeframe sufficient to allow ecosystems to adapt naturally to climate change.",independence,interference,indication,interruption,B,"A. independence /ˌɪndɪˈpendəns/ (n): sự độc lập, tự do | B. interference /ˌɪntəˈfɪərəns/ (n): sự can thiệp; sự xen vào | C. indication /ˌɪndɪˈkeɪʃn/ (n): sự biểu thị, biểu lộ | D. interruption /ˌɪntəˈrʌpʃn/ (n): sự gián đoạn, sự ngắt lời. Tạm dịch: Mục tiêu của giảm thiểu là để tránh sự can thiệp nguy hại của con người vào hệ thống khí hậu, và ổn định mức khí nhà kính theo một khung thời gian đủ để khiến hệ sinh thái thích nghi tự nhiên với biến đổi khí hậu."
85f3fc3e-1fae-4945-a5ce-edf8b0af55da,24,VOCAB,2,The Government has brought _____ a new law in an effort to prevent further environmental deterioration.,in,about,up,on,A,"A. bring in: ban hành (luật) | B. bring about: gây ra, đem lại | C. bring up: nuôi nấng | D. bring on: làm cho phải bàn cãi. Tạm dịch: Chính phủ vừa ban hành luật mới với nỗ lực ngăn chặn sự suy thoái môi trường."
66b3078e-d36c-46bd-a642-72bf12b78a87,16,VOCAB,2,The Government has embarked on policies extending incentives to the families bearing _____ girls.,innumerable,numerable,numeric,number,A,"A. innumerable /ɪ'nju:mərəbl/ (a): vô số | B. numerable /nju:mərəbl/ (aj: có thể đếm được | C. numeric /njui'merɪk/ (a): thuộc về số | D. number /‘nʌmbər/ (n): chữ số, con số. Tạm dịch: Chính phủ đã bắt tay vào thực hiện các chính sách tăng cường vô số sự ưu tiên đối với những gia đình sinh con gái."
8c9d709a-a62c-4944-be53-e978c5723027,16,GRAMMAR,2,The government has made a serious attempt to raise the _____ of living.,cost,standard,mode,level,B,"A. cost /kɒ:st/ (n): chi phí | B. standard /ˈstændəd/ (n): tiêu chuẩn | C. mode /məʊd/ (n): cách thức, phương thức | D. level /'levəl/ (n): mức độ. Cụm từ: Standard of living: chất lượng cuộc sống. Tạm dịch: Chính phủ đã có nỗ lực đáng kể để làm tăng chất lượng cuộc sống."
cc20a130-19ab-4575-b37e-e6165b17b104,4,GRAMMAR,2,The government has pledged to clean up industrial ___________.,emissions,emit,emitted,emissive,A,"A. emissions /iˈmɪʃən/ (n): sự thải ra, sự phát ra, khí thải | B. emit /iˈmɪt/ (v): thải ra | C. emitted (v): động từ hình thái Ved của emit | D. emissive /iˈmɪsɪv/ (a): phát ra, bốc ra, tỏa ra. Cấu trúc: pledge to do st: cam kết làm gì. Tạm dịch: Chính phủ cam kết sẽ làm sạch các khí thải công nghiệp."
1997bc24-4f6a-4c73-a277-0746a7c2c6c5,6,VOCAB,2,The government has spent £1 million on an advertising ___________ to encourage energy conservation.,campaign,promotion,operation,enterprise,A,"A. campaign /kæmˈpeɪn/(n): chiến dịch | B. promotion /prəˈməʊʃn/(n): sự thúc đẩy, sự thăng tiến | C. operation /ˌɒpəˈreɪʃn/(n): sự vận hành | D. enterprise /ˈentəpraɪz/(n): tổ chức kinh doanh, hãng, xí nghiệp. Tạm dịch: Chính phủ đã dành ra một triệu đô cho chiến dịch quảng cáo để khuyến khích sự bảo tồn năng lượng."
36d33ab2-37a9-4458-8467-a8ffff5a1a9f,8,VOCAB,2,The government is introducing strict new rules on the dumping of ___________ by industry.,pesticides,exhaust fumes,toxic waste,emissions,C,A. pesticide /ˈpestɪsaɪd/ (n): thuốc diệt cỏ | B. exhaust fumes: khói thải | C. toxic waste: chất thải độc hại | D. emission: sự thải ra. Tạm dịch: Chính phủ đã đưa ra một bộ luật mới nghiêm khắc hơn về việc thải chất thải độc hại trong ngành công nghiệp.
484a3d0b-90cc-4c78-8053-524378b7cd46,16,VOCAB,2,The Government is trying to persuade people to _____ their personal preferences and regulate their community behavior according to the new blueprint to stimulate the girl ratio.,suppress,supply,support,surplus,A,"A. suppress /sə'pres/ (v): đàn áp, giữ kín, tiết chế | B. supply /sə'plaɪ/ (v): cung cấp | C. support /sə'pɔːt/ (v): ủng hộ, hỗ trợ | D. surplus /'sɜ:pləs/ (n): số thặng dư. Tạm dịch: Chính phủ đang cố găng thuyết phục mọi người kìm nén những ưu tiên cá nhân và điều chỉnh những hoạt động của cộng đồng theo bản kế hoạch mới để tăng tỉ lệ sinh con gái."
8f055358-13f1-4c21-923c-fa54e09d0628,5,VOCAB,2,The gradual rise in the Earth’s temperature is known as ___________.,greenhouse effect,global warming,ozone layer,acid rain,B,B. global warming (n): hiện tượng nóng lên toàn cầu. Tạm dịch: Sự tăng dần nhiệt độ của trái đất được gọi là hiện tượng nóng lên toàn cầu.
3a6a8b6a-eede-4b37-86cd-f477d4b88007,19,VOCAB,2,The Great Wall of China is considered one of the greatest wonders in the world _____ its magnificence and significance.,in spite of,because,instead of,in view of,D,"A. in spite of: mặc dù | B. because: bởi vì | C. instead of: thay vì | D. in view of: xét về, xét vì. Tạm dịch: Vạn Lý Trường Thành của Trung Quốc được coi là một trong những kì quan đẹp nhất thế giới xét về sự tráng lệ và tầm quan trọng của nó."
d7f6d269-4f43-4402-ae58-7958ee06593b,20,VOCAB,2,"The Headquarter of this multinational organization is currently _____ , which means some people will have to be made redundant.",undersized,overused,overstaffed,undercharged,C,"A. undersized /ˌʌndə'saɪzd/ (a): còi cọc, có kích thước nhỏ hơn bình thường | B. overused /ˌəʊvə'ju:st/ (a): lạm dụng, dùng quá nhiều | C. overstaffed /ˌəʊvə'sta:ft/ (a): thừa nhân viên | D. undercharged /ˌʌndə'tʃa:dʒd/ (a): định giá quá thấp. Tạm dịch: Trụ sở chính của tổ chức đa quốc gia này hiện đang bị thừa nhận viên, điều đó có nghĩa là một số người sẽ trở nên không cần thiết (dư thừa)."
fb7193ac-93a7-4e62-8731-18725f68b9ef,14,VOCAB,2,The history of what we call cinema today began in the ___________ 19th century.,lately,late,early,next,C,"A. lately /'leɪtli/ (adv): gần đây | B. late /leɪt/ (a): trễ, muộn, cuối | C. early /'ɜ:li/ (a): sớm, đầu | D. next /nekst/ (a): kế tiếp. Tạm dịch: Lịch sử của ngành điện ảnh ngày nay đã bắt đầu từ đầu thế kỉ 19."
965a1981-58ca-45e6-b0b9-6798df14d7f5,21,VOCAB,2,The idea of building a _____ with human intelligence is not only ambitious but also highly unconventional.,robot,corporation,line,road,A,"A. robot /ˈrəʊbɒt/ (n): robot, người máy | B. corporation /ˌkɔːpəˈreɪʃn/ (n): tập đoàn | C. line /laɪn/ (n): đường kẻ | D. road /rəʊd/ (n): con đường. Tạm dịch: Ý tưởng xây dựng một con robot có trí thông minh của con người không chỉ tham vọng mà còn rất độc đáo."
c21eafb0-87dc-4a38-a6a0-a377473b125e,17,VOCAB,2,"The image of _____ Vietnamese women with creativeness, dynamism, success has become popular in Vietnam's society.",contemporary,temporary,permanent,conventional,A,"A. contemporary /kən'tempərəri/ (a): đương thời, đương đại | B. temporary /'tempərəri/ (a): tạm thời | C. permanent /'pɜːmənənt/ (a): vĩnh viễn | D. conventional /kən'venfənəl/ (a): truyền thống. Tạm dịch: Hình ảnh người phụ nữ Việt Nam đương thời với sự sáng tạo, năng động, thành công đã trở nên phổ biến trong xã hội Việt Nam."
d1317a1d-66ae-4dcf-95bd-c1da08c72735,24,GRAMMAR,2,"The International Committee of the Red Cross is a private _____ institution founded in 1863 in Geneva, Switzerland.",human,humanity,humanization,humanitarian,D,"A. human /'hju:mən/ (n): con người | B. humanity /hju:'mænəti/ (n): nhân loại | C. humanization /hju:mənaɪ'zeɪʃən/ (n): sự nhân tính hoá | D. humanitarian /hju:mænɪ'teəriən/ (a): nhân đạo. Tạm dịch: Hội chữ thập đỏ quốc tế là tổ chức nhân đạo tư nhân được thành lập năm 1863 ở Geneva, Switzerland."
0772fe87-3a05-4b90-88e7-52b2aa849b42,24,VOCAB,2,The International Red Cross and Red Crescent _____ occurs once every four years.,Globe,Society,Conference,Nations,C,A. Globe /gləʊb/ (n): toàn cầu | B. Society /səˈsaɪəti/ (n): xã hội | C. Conference /ˈkɒnfərəns/ (n): hội nghị | D. Nations /ˈneɪʃn/ (n): quốc gia. Tạm dịch: Hội chữ thập đỏ quốc tế và hội nghị trăng lưỡi liềm đỏ diễn ra bốn năm một lần.
1c9e8470-6384-49c0-971f-fd960d29942d,24,GRAMMAR,2,"The International Red Cross helps people in need without any discrimination based on _____ race, religion, class or political opinions.",nation,national,nationality,native,C,"A. nation /ˈneɪʃn/ (n): quốc gia | B. national /ˈnæʃnəl/ (a): thuộc quốc gia | C. nationality /ˌnæʃəˈnæləti/ (n): quốc tịch | D. native /ˈneɪtɪv/ (a): bản địa. Tạm dịch: Hội chữ thập đỏ giúp đỡ những người đang cần giúp đỡ mà không phân biệt về quốc tịch, chủng tộc, tôn giáo, tầng lớp hay quan điểm chính trị."
2889b151-88b3-47ec-ba6c-2c724e4a422e,25,GRAMMAR,2,"The Internet and mobile communication is now the most popular means of receiving information and _____ with people through email, instant messaging, apps, search engines, blogs.",interacting,updating,contacting,keeping,A,"A. interacting /ˌɪntərˈæktɪŋ/ (v-ing): tương tác | B. updating /ˌʌpˈdeɪtɪŋ/ (v-ing): cập nhật | C. contacting /ˈkɒntæktɪŋ/ (v-ing): liên lạc | D. keeping /ˈkiːpɪŋ/ (v-ing): giữ, duy trì. Tạm dịch: Internet và việc liên lạc di động bây giờ là kiểu phổ biến nhất để nhận thông tin và tương tác với mọi người thông qua thư điện tử, tin nhắn nhanh, các ứng dụng, những công cụ tìm kiếm, những blog."
9948147e-a036-4f69-b084-6196ed0dd86d,26,VOCAB,2,The intrinsic value of sporting events is _____ to cement the diplomatic ties among _____ Giaoandethitienganh.info _____ nations all over the world.,aggressively,undoubtedly,inconsistently,inadequately,B,"A. agressively /əˈɡresɪvli/ (adv): hung hăng | B. undoubtedly /ʌnˈdaʊtɪdli/ (adv): không còn nghi ngờ gì, chắc chắn | C. inconsistently /ˌɪnkənˈsɪstəntli/ (adv): đầy mâu thuẫn | D. inadequately /ɪnˈædɪkwətli/ (adv): không thỏa đáng Giaoandethitienganh.info. Tạm dịch: Giá trị thực chất của các sự kiện thể thao chắc chắn là để thắt chặt mối quan hệ ngoại giao giữa các nước trên toàn thế giới."
b959e11e-502e-49b4-ae0b-d8d399eba039,25,VOCAB,2,"The _____ involves TV, radio and even electronic forms of communication such as the Internet.",telecommunication,mass,network,press,B,"A. telecommunication /ˌtelikəˌmjuːnɪˈkeɪʃn/ (n): viễn thông | B. mass /mæs/ (n): truyền thông đại chúng | C. network /ˈnetwɜːk/ (n): mạng lưới | D. press /pres/ (n): báo chi. Tạm dịch: Phương tiện truyền thông đại chúng bao gồm vô tuyến, máy thu thanh và thậm chí cả những phương tiện điện tử của giao tiếp như Internet."
5943a84f-420d-4d18-a24f-03180985f695,24,VOCAB,2,The _____ is a legal agreement among the ten ASEAN member states.,charter,motto,policy,principle,A,A. charter /ˈtʃɑːrtər/ (n): hiến chương | B. motto /ˈmɒtəʊ/ (n): khẩu hiệu | C. policy /ˈpɒləsi/ (n): chính sách | D. principle /ˈprɪnsəpl/ (n): nguyên tắc. Tạm dịch: Hiến chương là sự đồng thuận hợp pháp giữa mười nước thành viên của ASEAN.
b4eb0124-bcbc-4279-b0f0-75727ac33fb9,25,VOCAB,2,The issue _____ question is more complex than you think.,in,from,on,at,A,"Cụm từ: in question: vẫn đang thảo luận, tranh cãi. Tạm dịch: vấn đề đang bàn cãi phức tạp hơn bạn nghĩ đấy."
c52454f8-6f7c-4097-b2ca-54cddb324420,22,VOCAB,2,"The latest addiction to trap thousands of people is Internet, which has been _____ for broken relationships, job losses, financial ruin and even one suicide.",accused,mistaken,blamed,faulted,C,"Câu trúc: Be blamed for st/doing st: bị đổ lỗi cho.... Tobe acused of doing smt: bị buộc tội làm gì. Tạm dịch: Thứ gây nghiện mới nhất cho nhiều người là Internet bị đổ lỗi vì đã gây ra tan vỡ các mối quan hệ, mất việc, phá hoại tài chính và thậm chí còn có người tự tử."
c4cb4854-da15-4943-ab90-cb8b107a0987,30,VOCAB,2,The latest in science news is inspirational for a new generation of thinkers who will continue to push the boundaries of human _____,inability,capability,disability,capacitation,B,"A. inability /ˌɪnəˈbɪləti/ (n): sự không có khả năng, sự bất tài | B. capability /ˌkeɪpəˈbɪləti/ (n): khả năng | C. disability /ˌdɪsəˈbɪləti/ (n): sự ốm yếu tàn tật | D. capacitation /kəˌpæsəˈteɪtʃən/ (n): khả năng. Tạm dịch: Tin tức khoa học gần đây nhất là nguồn cảm hứng cho một thế hệ mới của các nhà tư tưởng, những người sẽ tiếp tục nâng khả năng giới hạn của loài người lên cao hơn."
de12809b-16ac-46c6-aa9b-dd1c0419729c,8,VOCAB,2,"The local university has recently ___________ to students several ways to go green, which has had huge impact on the community.",introduced,enacted,passed,enforced,A,"A. introduce /ˌɪntrəˈdjuːs/ (v): giới thiệu | B. enact /ɪˈnækt/ (v): ban hành | C. pass /pɑːs/ (v): thông qua | D. enforce /ɪnˈfɔːs/ (v): bắt buộc. Tạm dịch: Trường đại học địa phương gần đây đã giới thiệu cho sinh viên rất nhiều phương pháp để làm những việc giúp ích cho môi trường, điều này có tác động lớn đến cộng đồng."
