id,cau_hoi,A,B,C,D,dap_an,giai_thich
1,"They were so excited about joining the local ___________ group that they couldn't sleep last night.",volunteer,voluntary,voluntarily,volunteerism,A,"A. volunteer /ˌvɒlənˈtɪə(r)/ (n): tình nguyện viên | B. voluntary (a): tình nguyện | C. voluntarily (adv). Căn cứ vào tính từ 'local' thì vị trí trống cần một danh từ. Tạm dịch: Họ đã rất hào hứng khi được gia nhập vào các nhóm tình nguyện viên ở địa phương."
2,"English teaching is considered a good example of a volunteer job which often turns ___________ a career.",off,up,on,into,D,"Cấu trúc: Turn into: biến thành. Tạm dịch: Dạy tiếng Anh được xem là một ví dụ điển hình của công việc tình nguyện, việc này thường biến thành một nghề nghiệp."
3,"A/an ___________ is a person who needs others to take care of him/her, because of illness that he/she had for a long time.",patient,martyr,invalid,addict,C,"A. patient: bệnh nhân | B. martyr: liệt sĩ | C. invalid /ɪnˈvælɪd/ (n): người bệnh tật, người tàn tật | D. addict: người nghiện. Tạm dịch: Một người tàn tật là người cần sự chăm sóc của người khác vì bệnh lâu ngày."
4,"Mr. Chen is more ___________ because he has finally agreed to allow his daughter to join an overseas volunteer organization in Africa.",single-minded,narrow-minded,absent-minded,open-minded,D,"A. single-minded: quyết tâm | B. narrow-minded: hẹp hòi | D. open-minded /ˌəʊpən ˈmaɪndɪd/ (a): cởi mở, rộng lượng. Tạm dịch: Ông Chen đã dễ tính hơn (cởi mở hơn) khi cho con gái tham gia tình nguyện quốc tế."
5,"A lot of generous businessmen have ___________ valuable contributions to helping needy people.",done,taken,made,given,C,"Cấu trúc: make contributions to: đóng góp, ủng hộ. Tạm dịch: Nhiều doanh nhân hào phóng đã ủng hộ để giúp đỡ những người khó khăn."
6,"Volunteer organizations are generally small-staffed, so they need to ___________ lots of volunteers for a huge event.",employ,recruit,research,catch,B,"A. employ: thuê | B. recruit /rɪˈkruːt/ (v): tuyển | C. research: nghiên cứu. Tạm dịch: Các tổ chức tình nguyện thường ít nhân viên nên cần tuyển thêm nhiều tình nguyện viên cho sự kiện lớn."
7,"You’d better ___________ a commitment to being a volunteer on a regular basis.",promise,do,make,pull,C,"Cấu trúc: Make a commitment to doing st: cam kết, dốc sức làm gì. Tạm dịch: Tốt hơn bạn nên làm một cam kết để trở thành một tình nguyện viên thường xuyên."
8,"They visit a retirement home and ___________ time doing fun activities with the elderly who lack immediate family.",spend,lose,waste,consume,A,"A. spend /spend/ (v): dành (thời gian) | B. lose: đánh mất | C. waste: lãng phí. Tạm dịch: Chúng tôi đến thăm viện dưỡng lão và dành nhiều thời gian để chơi với các cụ già."
9,"Both community ___________ and volunteerism are an investment in our community and the people who live in it.",life,language,performance,service,D,"D. service /ˈsɜːvɪs/ (n): dịch vụ. Community service: dịch vụ cộng đồng. Tạm dịch: Cả dịch vụ cộng đồng và phong trào tình nguyện đều là sự đầu tư cho cộng đồng."
10,"When you get involved in a volunteer project, you are able to ___________ your knowledge into practice.",take,put,bring,push,B,"Cấu trúc: Put one's knowledge into practice: áp dụng kiến thức vào thực tế. Tạm dịch: Khi tham gia dự án tình nguyện, bạn có thể áp dụng những kiến thức đã học vào thực tế."
11,"These ___________ children encounter many problems and really need our help.",disadvantaged,advantaged,disadvantage,advantage,A,"A. disadvantaged /ˌdɪsədˈvɑːntɪdʒd/ (a): thiệt thòi. Căn cứ vào danh từ 'children' cần một tính từ. Tạm dịch: Những trẻ em thiệt thòi đang phải đối mặt với nhiều vấn đề khó khăn."
12,"Volunteers can work with many ___________ children who were harmed by Agent Orange in childcare centres.",parentless,disabled,poor,homeless,B,"B. disabled /dɪˈseɪbld/ (a): khuyết tật. Tạm dịch: Tình nguyện viên có thể làm việc với những trẻ em khuyết tật chịu ảnh hưởng bởi chất độc màu da cam."
13,"Many international volunteer organizations are trying to find a ___________ to the problem of world hunger.",way,method,suggestion,solution,D,"D. solution /səˈluːʃn/ (n): giải pháp. Tạm dịch: Nhiều tổ chức tình nguyện quốc tế đang cố gắng tìm ra giải pháp cho nạn đói trên thế giới."
14,"Contact is ___________ connecting students with volunteer organizations abroad.",in place of,in charge of,in case of,in danger of,B,"B. in charge of (sb/st): chịu trách nhiệm cho ai/cái gì. Tạm dịch: Liên lạc đảm nhiệm kết nối học sinh với các tổ chức tình nguyện quốc tế."
15,"Football superstar David Beckham has a huge ___________ for kids in need.",head,strength,memory,heart,D,"D. heart /hɑːt/ (n): trái tim. Cấu trúc: Have a huge heart for sb: có tấm lòng nhân hậu dành cho ai. Tạm dịch: Beckham có một tấm lòng hào hiệp dành cho những đứa trẻ thiếu thốn."
16,"Everyone can help the needy by making a ___________ to a charity organization.",donate,donation,donor,donating,B,"B. donation /dəʊˈneɪʃn/ (n): vật tặng, khoản tặng. Cấu trúc: make a donation: quyên góp. Tạm dịch: Mọi người có thể giúp đỡ người nghèo bằng cách quyên góp cho tổ chức từ thiện."
17,"___________ believe that some of the happiest people in the world are those who help to bring happiness to others.",Voluntary,Voluntarily,Volunteer,Volunteers,D,"D. Volunteers (n-số nhiều). Căn cứ vào động từ 'believe' ở dạng số nhiều nên cần danh từ số nhiều làm chủ ngữ. Tạm dịch: Các tình nguyện viên cho rằng giúp đỡ người khác đem lại niềm vui."
18,"During summer holidays, university students are willing to take part in providing education for children in remote and ___________ areas.",mountain,mountainous,mountaineer,mountaineering,B,"B. mountainous /ˈmaʊntənəs/ (a): có nhiều núi, rộng lớn. Căn cứ vào danh từ 'areas' cần một tính từ đứng trước. Tạm dịch: Sinh viên sẵn lòng dạy học cho trẻ em vùng sâu vùng xa."
19,"The lottery winner was willing to spend a considerable sum of money to ___________ charity to help those in need.",give away,give in,give back,give up,A,"A. give away: cho đi mà không cần nhận lại, tặng. Tạm dịch: Người trúng số sẵn lòng dành một khoản tiền đáng kể tặng cho các hội từ thiện."
20,"The volunteer team ___________ students with various visual, hearing, physical and cognitive impairments every two months to give them both financial and spiritual support.",call back,call off,call on,call out,C,"C. call on (sb): ghé thăm. Tạm dịch: Cứ hai tháng một lần, nhóm tình nguyện lại ghé thăm những học sinh khuyết tật để hỗ trợ tài chính và tinh thần."
21,"If one wants to take part in volunteer organizations such as Green Summer Camp, Green Saturday Movement, Blood Donor..., he/she will have to ___________ an application form.",fill in,find out,log on,send off,A,"A. fill in: điền vào. Tạm dịch: Nếu muốn tham gia các tổ chức tình nguyện, anh/cô ấy phải điền vào mẫu đơn xin gia nhập."
22,"After the visit to that special school, we ___________ friends with some students with reading disabilities.",acquainted,had,made,realized,C,"Cấu trúc: make friend: kết bạn. Tạm dịch: Sau chuyến thăm ngôi trường đặc biệt đó, chúng tôi đã kết bạn với một số học sinh mắc chứng khó đọc."
23,"Elderly housebound patients are often those most in ___________ of pharmacy services.",case,need,time,trouble,B,"B. need /niːd/ (n): nhu cầu. Cấu trúc: In need of st: cần cái gì. Tạm dịch: Bệnh nhân cao tuổi tại nhà thường là những người cần dịch vụ thuốc men nhất."
24,"The Youth Union in our school has decided to launch a/an ___________ to raise funds for local charities.",activity,announcement,campaign,decision,C,"C. campaign /kæmˈpeɪn/ (n): chiến dịch. Cấu trúc: Launch a campaign: phát động chiến dịch. Tạm dịch: Đoàn thanh niên đã phát động chiến dịch gây quỹ từ thiện."
25,"ASL (American Sign Language), a language that is expressed through the hands and face and is perceived through the eyes, is every useful for the ___________.",blind,mentally disabled,dumb,mentally retarded,C,"C. dumb /dʌm/ (a): câm. Tạm dịch: Ngôn ngữ ký hiệu Mỹ (ASL) rất hữu ích cho những người bị câm."
26,"___________ children get sick four times as often as children in permanent homes and also suffer from anxiety and depression at a higher rate than stably housed children.",Ill-educated,Homeless,Homely,Weak,B,"B. Homeless /ˈhəʊmləs/ (a): vô gia cư. Tạm dịch: Trẻ em vô gia cư thường bị ốm nhiều gấp 4 lần so với trẻ em có nhà cửa ổn định."
27,"Talented students with a disability should be helped to become independent, ___________ in the society and achieve success at school.",contribute,integrate,involve,socialize,C,"C. involve /ɪnˈvɒlv/ (v): tham gia. Cấu trúc: involve in: tham gia vào. Tạm dịch: Học sinh khuyết tật tài năng nên được giúp đỡ để hòa nhập xã hội và thành công tại trường."
28,"Many people who took part in the fight ___________ illiteracy considered it an honorable job to help others.",against,back,for,with,A,"Cấu trúc: Fight against: đấu tranh chống lại. Tạm dịch: Nhiều người tham gia cuộc đấu tranh chống nạn mù chữ xem đây là công việc vinh quang."
29,"Recently, a gang of enterprising New Zealanders has introduced an incredible scheme to raise awareness of ___________ and mental health issues.",stagnation,depression,disappointment,irritation,B,"B. depression /dɪˈpreʃn/ (n): bệnh trầm cảm. Tạm dịch: Nhóm người New Zealand đã đưa ra kế hoạch nâng cao nhận thức về bệnh trầm cảm và sức khỏe tâm thần."
30,"Joining a hand in helping your community helps you gain experience ___________ many fields such as education, social work and health care.",in,out,during,into,A,"Cấu trúc: Gain experience in st: có được kinh nghiệm trong lĩnh vực gì. Tạm dịch: Giúp đỡ cộng đồng giúp bạn có thêm kinh nghiệm trong giáo dục, công tác xã hội."