id,cau_hoi,A,B,C,D,dap_an,giai_thich
1,"Doctor said that if he practiced ___________ every day, he could keep his mind stress-free.",immune system,meditation,acupuncture,a diet,B,"A. immune system: hệ miễn dịch | B. meditation /ˌmedɪˈteɪʃən/ (n): thiền định | C. acupuncture /ˈækjupʌŋktʃər/ (n): thuật châm cứu | D. diet /ˈdaɪət/ (n): chế độ ăn. Tạm dịch: Bác sĩ nói rằng nếu anh ấy luyện tập ngồi thiền mỗi ngày, anh ấy sẽ tránh được căng thẳng."
2,"Sleep, rest and relaxation can slow down the ___________.",ageing process,life expectancy,cholesterol,health,A,"A. ageing process: quá trình lão hóa | B. life expectancy: tuổi thọ | C. cholesterol /kəˈlestərɒl/ (n): cholesterol | D. health /helθ/ (n): sức khỏe. Cấu trúc: slow down: làm chậm. Tạm dịch: Ngủ, nghỉ ngơi và thư giãn có thể làm chậm quá trình lão hóa."
3,"If you catch a cold, you should try natural ___________ before taking any medicine.",medicines,remedies,foods,ways,B,"A. medicine /ˈmedɪsən/ (n): thuốc | B. remedy /ˈremədi/ (n): phương thuốc | C. food /fuːd/ (n): thức ăn | D. way /weɪ/ (n): đường đi. Cấu trúc: catch a cold: bị cảm. Tạm dịch: Nếu bạn bị cảm, bạn nên thử những phương thuốc tự nhiên trước khi dùng thuốc tây."
4,"Fast food ___________ can increase the risk of obesity and heart disease.",consumptions,consuming,consume,consumption,D,"A. consumptions /kənˈsʌmpʃən/ (n-số nhiều) | B. consuming /kənˈsjuːmɪŋ/ (a): ám ảnh, chi phối | C. consume /kənˈsjuːm/ (v): tiêu thụ | D. consumption /kənˈsʌmpʃən/ (n): sự tiêu thụ. Tạm dịch: Tiêu thụ đồ ăn nhanh có thể làm tăng nguy cơ béo phì và các bệnh về tim mạch."
5,"Staying ___________ is half of the secret to weight control, the other half is healthy diet.",active,actively,inactive,inactively,A,"A. active /ˈæktɪv/ (a): tích cực | B. actively /ˈæktɪvli/ (adv): tích cực, hăng hái | C. inactive /ɪnˈæktɪv/ (a): không hoạt động, ì ạch | D. inactively /ɪnˈæktɪvli/ (adv): không hoạt động. Căn cứ vào ""stay"" thì trong ô trống ta cần một tính từ (cấu trúc: stay +Adj). Tạm dịch: Sống tích cực là một nửa bí quyết để kiểm soát cân nặng, nửa còn lại là chế độ ăn uống lành mạnh."
6,"After spending a week in bed, she made a complete ___________.",recover,recovering,recovery,recovered,C,"A. recover /rɪˈkʌvər/ (v): hồi phục | B. recovering /rɪˈkʌvərɪŋ/ (V-ing) | C. recovery /rɪˈkʌvəri/ (n): sự hồi phục | D. recovered /rɪˈkʌvərd/ (V-ed). Căn cứ vào tính từ ""complete"" thì trong ô trống ta cần một danh từ. Tạm dịch: Sau khi phải nằm cả tuần trên giường bệnh, cô ấy đã hồi phục hoàn toàn."
7,"Daily exercise and weight control strongly influence your chances of staying ___________.",health,healthy,healthily,healthiness,B,"A. health /helθ/ (n): sức khỏe | B. healthy /ˈhelθi/ (a): tốt cho sức khỏe | C. healthily /ˈhelθili/ (adv): một cách khỏe mạnh | D. healthiness /ˈhelθinəs/ (n): sự khỏe mạnh. Căn cứ vào ""stay"" thì trong ô trống ta cần một tính từ (cấu trúc: stay +Adj). Tạm dịch: Tập thể dục hàng ngày và kiểm soát cân nặng ảnh hưởng lớn đến cơ hội sống khỏe mạnh của bạn."
8,"In addition to a nutritious diet, a ___________ lifestyle can boost your health and increase your life expectancy.",stress-free,sugar-free,cholesterol-free,anti-ageing,A,"A. stress-free: không căng thẳng | B. sugar-free: không có đường | C. cholesterol-free: không chứa cholesterol | D. anti-ageing: chống lão hóa. Tạm dịch: Cùng với một chế độ ăn uống giàu dinh dưỡng thì một lối sống không căng thẳng có thể cải thiện sức khỏe và tăng tuổi thọ của bạn."
9,"Science has shown that many types of chronic diseases are ___________ to people's bad eating habits.",given,attributed,contributed,caused,B,"A. give /ˈɡɪv/ (v): tặng | B. attribute /ˈæt rɪbjuːt/ (v): quy cho | C. contribute /kənˈtrɪbjuːt/ (v): đóng góp | D. cause /kɔːz/ (v): gây ra. Tạm dịch: Khoa học đã chỉ ra rằng rất nhiều bệnh mãn tính gây ra bởi thói quen ăn uống không lành mạnh của con người."
10,"People are always advised to ___________ smoking because of its harm to their health.",cut down,cut off,cut in,cut down on,D,"A. cut down: giảm | B. cut off: cắt bỏ | C. cut in: cắt ngang, xen vào | D. cut down on: giảm bớt. Tạm dịch: Người ta luôn được khuyên là nên giảm bớt việc hút thuốc bởi vì thuốc lá có hại cho sức khỏe."
11,"You have to take the full ___________ of your antibiotics even if you feel better, otherwise your illness will simply return.",course,prescription,receipt,treatment,A,"A. course /kɔːs/ (n): tiến trình | B. prescription /prɪˈskrɪpʃən/ (n): việc kê đơn | C. receipt /rɪˈsiːt/ (n): công thức | D. treatment /ˈtriːtmənt/ (n): sự chữa trị. Tạm dịch: Bạn phải uống thuốc kháng sinh thậm chí ngay cả lúc bạn đã cảm thấy tốt hơn. Nếu không, bạn sẽ bị ốm trở lại."
12,"500 years ago, the average human ___________ was about 40 years.",lifespan,lifetime,life cycle,life length,A,"A. lifespan /ˈlaɪfspæn/ (n): tuổi thọ | B. lifetime /ˈlaɪftaɪm/ (n): thời gian sống | C. life cycle: vòng đời. Tạm dịch: 500 năm trước, tuổi thọ trung bình của con người ở mức khoảng 40 tuổi."
13,"She wishes that we hadn't sent her the candy yesterday because she's on a ___________.",debt,diet,scale,death,B,"A. debt /det/ (n): nợ | B. diet /ˈdaɪət/ (n): chế độ ăn uống | C. scale /skeɪl/ (n): cái cân | D. death /deθ/ (n): cái chết. Cấu trúc: be on diet: ăn kiêng. Tạm dịch: Cô ấy ước rằng chúng tôi đã không tặng cô ấy kẹo ngày hôm qua vì cô ấy đang ăn kiêng."
14,"He sent his children to the park so that he could have some ___________.",fresh and quiet,quiet and peace,peace and quiet,fresh and peace,C,"C. peace and quiet: bình yên. Tạm dịch: Anh ta đưa con mình đến công viên để anh ta có thể tận hưởng một chút bình yên."
15,"In the wake of increasing food poisoning, many consumers have turned to vegetables grown ___________.",homely,thickly,wildly,organically,D,"A. homely /ˈhəʊmli/ (a): giản dị, chất phác | B. thickly /ˈθɪkli/ (adv): dày | C. wildly /ˈwaɪldli/ (adv): hoang dã | D. organically /ɔːˈɡænɪkli/ (adv): hữu cơ. Tạm dịch: Trong bối cảnh ngộ độc thực phẩm gia tăng, rất nhiều khách hàng đã chuyển qua sử dụng rau quả hữu cơ."
16,"Obesity is a medical condition in which excess body fat has ___________ to the extent that it may have a negative effect on health.",accumulated,measured,obtained,eliminated,A,"A. accumulate /əˈkjuːmjəleɪt/ (v): tích lũy | B. measure /ˈmeʒər/ (v): đo lường | C. obtain /əbˈteɪn/ (v): đạt được | D. eliminate /ɪˈlɪmɪneɪt/ (v): loại bỏ. Tạm dịch: Béo phì là một bệnh y học mà mỡ thừa trong cơ thể tích lũy nhiều đến mức có ảnh hưởng tiêu cực cho sức khỏe."
17,"The controller of the body is the ___________ system. Led by the brain and nerves, it allows us to move, talk and feel emotions.",circulatory,digestive,nervous,respiratory,C,"A. circulatory /ˌsɜːkjəˈleɪtəri/ (a): (thuộc) sự tuần hoàn máu | B. digestive /daɪˈdʒestɪv/ (a): tiêu hóa | C. nervous /ˈnɜːvəs/ (n): thần kinh | D. respiratory /rɪˈspɪrətəri/ (a): (thuộc) hô hấp. Tạm dịch: Cơ quan điều khiển toàn bộ cơ thể là hệ thần kinh. Được dẫn dắt bởi não và các dây thần kinh, nó làm cho ta di chuyển, nói chuyện và có cảm xúc."
18,"A healthy ___________ between work and play ensures that everyone has a chance to enjoy their lives.",balance,control,equality,share,A,"A. balance /ˈbæləns/ (n): sự cân bằng | B. control /kənˈtrəʊl/ (n): sự kiểm soát | C. equality /iˈkwɒləti/ (n): sự công bằng | D. share /ʃeər/ (n): sự chia sẻ. Cấu trúc: have a chance: có cơ hội. Tạm dịch: Một sự cân bằng hợp lý giữa làm việc và vui chơi đảm bảo rằng mọi người đều có cơ hội tận hưởng cuộc sống."
19,"I've been a night owl ___________ up late for years, hitting the sheets anytime between 12 and 3 a.m.",finishing,getting,staying,waking,C,"Night owl: người thức khuya | Hit the sheet: đi ngủ | Stay up: thức. Tạm dịch: Tôi đã từng là một con cú đêm thức khuya nhiều năm liền, chỉ đi ngủ trong khoảng từ 12 đến 3 giờ sáng."
20,"The symptoms of depression can include poor ___________ and weight loss.",audience,authority,appetite,apology,C,"A. audience /ˈɔːdiəns/ (n): khán giả | B. authority /ɔːˈθɒrəti/ (n): chính quyền | C. appetite /ˈæpətaɪt/ (n): sự ngon miệng | D. apology /əˈpɒlədʒi/ (n): lời xin lỗi. Tạm dịch: Biểu hiện của bệnh trầm cảm có thể là sự chán ăn và giảm cân."
21,"The virus affects the body's immune system so that it cannot fight ___________.",affection,infection,effective,reflection,B,"A. affection /əˈfekʃən/ (n): bệnh tật | B. infection /ɪnˈfekʃən/ (n): sự nhiễm trùng | C. effective /ɪˈfektɪv/ (a): hiệu quả | D. reflection /rɪˈflekʃən/ (n): sự phản chiếu. Tạm dịch: Virut đã ảnh hưởng đến hệ thống miễn dịch của cơ thể, nên cơ thể không thể chống lại sự nhiễm trùng."
22,"The operation could ___________ his life by two or three years.",prolong,longevity,prolonging,length,A,"A. prolong /prəˈlɒŋ/ (v): kéo dài | B. longevity /lɒnˈdʒevəti/ (n): tuổi thọ | D. length /leŋθ/ (n): chiều dài, độ dài. Tạm dịch: Cuộc phẫu thuật có thể kéo dài sự sống cho cậu bé thêm 2 hoặc 3 năm nữa."
23,"We all know that eating right can help you maintain a healthy weight and avoid certain health problems, but your diet can also have a ___________ effect on your mood and sense of well-being.",promote,protect,profound,produce,C,"A. promote /prəˈməʊt/ (v): thúc đẩy | B. protect /prəˈtekt/ (v): bảo vệ | C. profound /prəˈfaʊnd/ (a): sâu sắc, hoàn toàn | D. produce /prəˈveɪd/ (v): sản xuất. Căn cứ vào mạo từ ""a"" và danh từ ""effect"" trong ô trống ta cần một tính từ. Tạm dịch: Tất cả chúng ta đều biết rằng ăn uống đúng cách có thể giúp duy trì cân nặng thích hợp và tránh những vấn đề về sức khỏe, nhưng chế độ ăn của bạn cũng có thể ảnh hưởng sâu sắc đến tâm trạng và cảm giác hạnh phúc."
24,"Eating more fresh fruits and vegetables, cooking meals at home, and reducing your ___________ of sugar and refined carbohydrates, on the other hand, may help to improve mood and lower your risk for mental health problems.",indent,induce,intake,inhale,C,"A. indent /ɪnˈdent/ (v): làm lõm xuống | B. induce /ɪnˈdjuːs/ (v): xui khiến, thuyết phục | C. intake /ˈɪnteɪk/ (n): sự lấy vào | D. inhale /ɪnˈheɪl/ (v): hít vào. Tạm dịch: Mặt khác, ăn nhiều trái cây và rau củ sạch, nấu ăn ở nhà, giảm hấp thụ đường cũng như cacbonhidrat tinh có thể giúp cải thiện tâm trạng và làm giảm những nguy cơ mắc các bệnh về thần kinh."
25,"Tobacco not only affects you and the people around you, but can ___________ to serious health conditions including lung and heart disease.",go,influence,lead,point,C,"A. go /ɡəʊ/ (v): đi | B. influence /ˈɪnfluəns/ (n): ảnh hưởng | C. lead /liːd/ (v): dẫn đến (lead to st: dẫn tới cái gì) | D. point /pɔɪnt/ (v): chỉ ra. Tạm dịch: Thuốc lá không chỉ làm ảnh hưởng đến bạn và những người xung quanh mà còn có thể dẫn đến những bệnh nghiêm trọng như ung thư phổi và bệnh về tim mạch."
26,"Chocolate and cakes cause our blood sugar to rise and give us a quick ___________.",boost,power,action,success,A,"A. boost /buːst/ (n): sự cải thiện, thúc đẩy | B. power /paʊər/ (n): năng lượng | C. action /ˈækʃən/ (n): hành động | D. success /səkˈses/ (n): thành công. Tạm dịch: Sô-cô-la và bánh ngọt làm tăng lượng đường trong máu và khiến ta hoạt động nhanh hơn."
27,"Reducing saturated fat is the single most important ___________ change you can make to cut blood cholesterol.",life,food,menu,dietary,D,"A. life /laɪf/ (n): cuộc sống | B. food /fuːd/ (n): thức ăn | C. menu /ˈmenjuː/ (n): thực đơn | D. dietary /ˈdaɪətəri/ (n): chế độ ăn. Tạm dịch: Giảm chất béo bão hòa là cách thay đổi chế độ ăn uống quan trọng nhất bạn có thể làm để cắt giảm lượng cholesterol trong máu."
28,"The university graduates one of the highest percentages of registered dieticians and ___________ in the world.",nutrition,nutrients,nutritionists,nutritious,C,"A. nutrition /njuːˈtrɪʃən/ (n): thực phẩm dinh dưỡng | B. nutrient /ˈnjuːtriənt/ (n): chất dinh dưỡng | C. nutritionist /njuːˈtrɪʃənɪst/ (n): chuyên gia dinh dưỡng | D. nutritious /njuːˈtrɪʃəs/ (a): giàu dinh dưỡng. Tạm dịch: Trường đại học đó cấp bằng tốt nghiệp cho nhiều nhà tư vấn chế độ ăn kiêng và chuyên gia dinh dưỡng nhất trên thế giới."
29,"Many people see fad diets ___________ harmless ways of losing weight, and they are grateful to have them.",by,like,through,as,D,"Cấu trúc: see st as: coi cái gì đó như là. Tạm dịch: Nhiều người coi chế độ ăn kiêng theo mốt là cách giảm cân vô hại, và họ rất cảm kích khi có chúng."
30,"If you are tired, even if you feel that you need to get more done, give yourself ___________ to sleep.",request,requirement,permission,permit,C,"A. request /rɪˈkwest/ (v): yêu cầu | B. requirement /rɪˈkwaɪəmənt/ (n): sự yêu cầu | C. permission /pəˈmɪʃən/ (n): sự cho phép | D. permit /ˈpɜːmɪt/ (v): cho phép. Cấu trúc: give sb permission to do st: cho phép ai làm gì. Tạm dịch: Nếu bạn cảm thấy mệt, ngay cả khi bạn cảm thấy cần làm nhiều việc, hãy cho phép bản thân mình được đi ngủ."