id,cau_hoi,A,B,C,D,dap_an,giai_thich
1,"I didn't want to disturb the meeting. I left without saying goodbye.",Rather than disturb the meeting I left without saying goodbye.,I disturbed the meeting because I said goodbye.,I would rather disturb the meeting than leaving without saying goodbye.,The meeting was disturbed as I left saying goodbye.,A,"Dịch: Hơn là làm cắt ngang cuộc họp, tôi rời đi mà không nói lời tạm biệt. ""Rather than"" phù hợp để diễn tả sự lựa chọn thay thế nhằm tránh một việc khác."
2,"Having spent all his money, Daniel couldn't afford a new watch.",As Daniel had bought a new watch he spent all his money.,Danile didn't buy a new watch although he had a lot of money.,Because he had spent all the money Daniel couldn't afford a new watch.,Daniel couldn't get a new watch because he didn't have much money.,C,"Phân từ hoàn thành ""Having Vp2"" dùng để chỉ hành động xảy ra trước. Câu viết lại dùng ""Because"" để chỉ nguyên nhân tiêu hết tiền dẫn đến không mua được đồng hồ."
3,She doesn't want to go to their party. We don't want to go either.,Either we or she wants to go to their party.,Neither we nor she want to go to their party.,Neither we nor she wants to go to their party.,Neither she nor we don't want to go to their party.,C,"Cấu trúc ""Neither S1 nor S2"" (Cả S1 và S2 đều không). Động từ chia theo chủ ngữ thứ 2 (she) nên dùng ""wants"" số ít."
4,"Noisy as the hotel was, they stayed there.",Much as the hotel was noisy they stayed there.,In spite of the noisy hotel and they liked it.,Despite the hotel was noisy they stayed there.,Although the noisy hotel they stayed there.,A,"Cấu trúc nhấn mạnh: ""Adj + as + S + be"" tương đương với ""Much as + S + be + adj"" (Mặc dù...)."
5,She was so busy that she couldn't answer the phone.,She was very busy that she couldn't answer the phone.,She was too busy to answer the phone.,She was too busy not to answer the phone.,She was very busy so that she couldn't answer the phone.,B,"Chuyển đổi giữa cấu trúc ""So... that"" (quá... đến nỗi) sang ""Too... to V"" (quá... để làm gì)."
6,Tim graduated with a good degree. He joined the ranks of the unemployed.,Tim joined the ranks of the unemployed because he graduated with a good degree.,If Tim graduated with a good degree he would join the ranks of the unemployed.,Though Tim graduated with a good degree he joined the ranks of the unemployed.,That Tim graduated with a good degree helped him join the ranks of the unemployed.,C,"Dịch: Mặc dù Tim tốt nghiệp bằng giỏi (vế tích cực), anh ấy vẫn thất nghiệp (vế tiêu cực) -> Dùng ""Though"" chỉ sự tương phản."
7,"In spite of his poverty, he led a devoted life to the revolutionary cause.",He could not devote his life to the revolutionary cause because of his poverty.,Although he was poor he led a devoted life to the revolutionary cause.,If he had not been so poor he could have devoted his life to the revolutionary cause.,He led a devoted life to the revolutionary cause but he was so poor.,B,"Chuyển đổi cụm danh từ ""In spite of his poverty"" sang mệnh đề ""Although he was poor""."
8,She tried very hard to pass the driving test. She could hardly pass it.,Although she didn't try hard to pass the driving test she could pass it.,She tried very hard so she passed the driving test satisfactorily.,No matter how hard she tried she could hardly pass the driving test.,Despite being able to pass the driving test she didn't pass it.,C,"Cấu trúc: ""No matter how + adj/adv + S + V"" (Dù có... thế nào đi chăng nữa)."
9,Smallpox is a dangerous disease. Malaria is a dangerous disease.,Smallpox is a dangerous disease and so is malaria.,Malaria is a dangerous disease but smallpox is not.,Neither smallpox nor malaria is a dangerous disease.,Either smallpox or malaria is a dangerous disease.,A,"Cấu trúc đồng tình khẳng định: ""S1 + be..., and so + be + S2"" (A là..., và B cũng thế)."
10,"Transportation has been made much easier thanks to the invention of car. However, cars are the greatest contributor of air pollution.",The invention of cars has made transportation much easier but cars are among the greatest contributors of air pollution.,However easier the invention of cars has made transportation it is cars that among the greatest contributors of air pollution.,Although the invention of cars has made transportation much easier cars are the greatest contributor of air pollution of air.,Although the invention of cars has made transportation much easier people use cars to contribute to the pollution of air.,C,"Dùng ""Although"" để nối hai câu có ý nghĩa đối lập về lợi ích và tác hại của ô tô."
11,I thought she was the right person for the position yet it turned put that she was quite useless.,Because I was expecting her to be competent I was shocked to see her perform rather badly.,I was mistaken about her suitability for the position since she proved rather incompetent.,Contrary to my initial impression she was not totally unsuitable for the position.,I was right in thinking that she was totally useless for the job.,B,"Dịch: Tôi đã nhầm lẫn về sự phù hợp của cô ấy (mistaken about suitability) vì cô ấy thể hiện sự vô dụng (incompetent)."
12,The substance is very toxic. Protective clothing must be worn at all times.,Since the substance is very toxic so protective clothing must be worn at all times.,So toxic is the substance that protective clothing must be worn at all times.,The substance is such toxic that protective clothing must be worn at all times.,The substance is too toxic to wear protective clothing at all times.,B,"Đảo ngữ với So: ""So + adj + be + S + that..."" (Cái gì đó quá... đến nỗi mà...)."
13,The film was not interesting. However he tried to watch the whole film.,In spite of the film uninteresting he tried to watch the whole film.,Uninteresting as the film was he tried to watch the whole film.,Despite of uninteresting film he tried to watch the whole film.,Uninteresting as was the film he tried to watch the whole film.,B,"Cấu trúc đảo ngữ nhượng bộ: ""Adj + as + S + be"" (Dù cho phim không hay...)."
14,"Although she was very old, she looked very grateful.",In spite of very old she looked very grateful.,Despite she was very old she looked very grateful.,Despite her old age she looked very grateful.,In spite her being old she looked very grateful.,C,"Cấu trúc: ""Despite + cụm danh từ/V-ing"". ""Her old age"" là cụm danh từ chính xác."
15,She gets up early to prepare breakfast so that her children can come to school on time.,Despite her getting up early to prepare breakfast her children cannot come to school on time.,Because she wanted her children to come to school on time she gets up early to prepare breakfast.,If she does not get up early to prepare breakfast her children will not come to school on time.,Unless she gets up early to prepare breakfast her children will not come to school on.,B,"Chuyển đổi từ mệnh đề chỉ mục đích (so that) sang mệnh đề chỉ nguyên nhân (Because)."
16,I whispered as I didn't want anybody to hear our conversation.,So as not to hear our conversation I whispered.,Since nobody wanted to hear our conversation I whispered.,Because I whispered nobody heard our conversation.,I lowered my voice in order that our conversation couldn't be heard.,D,"""Lowered my voice"" đồng nghĩa với ""whispered"". Cấu trúc ""in order that + mệnh đề"" chỉ mục đích."
17,"Though he tried hard, he didn't succeed.",However he tried hard he didn't succeed.,However hard he tried he didn't succeed.,However he didn't succeed hard he tried hard.,However he tried hard but he didn't succeed.,B,"Cấu trúc: ""However + adj/adv + S + V"" (Cho dù... thế nào đi chăng nữa)."
18,"Crazianna is a big country. Unfortunately, it has never received respect from its neighbours.",Though Crazianna is a big country it has never received respect from its neighbours.,Crazianna has never received respect from its neighbours because it is a big country.,It is Crazianna a big country that has never received respect from its neighbours.,Crazianna is such a big country that it has never received respect from its neighbours.,A,"Sử dụng ""Though"" để thay thế cho trạng từ ""Unfortunately"" nhằm nối hai câu tương phản."
19,"Slippery as the roads were, they managed to complete the race.",The roads were so slippery that they could hardly complete the race.,The roads were slippery but they managed to complete the race.,The roads were slippery so they could hardly complete the race.,The roads were so slippery; therefore they could hardly complete the race.,B,"""Adj + as + S + be"" chỉ sự nhượng bộ (Mặc dù...). Viết lại với ""but"" để giữ nguyên ý nghĩa tương phản."
20,They decided to go for a picnic though it was very cold.,Because it was very cold they decided to go for a picnic.,However cold it was they decided to go for a picnic.,If it had been cold they would not have gone for a picnic.,It was very cold so they decided to go for a picnic.,B,"Cấu trúc ""However + adj + S + be"" tương đương với ""though""."
21,Both Peter and Mary enjoy scientific expedition.,It is not Peter but Mary that enjoys scientific expedition.,Peter enjoys scientific expedition. Therefore does Mary.,However Peter enjoys scientific expedition and Mary does.,Peter enjoys scientific expedition and so does Mary.,D,"Sử dụng cấu trúc tán thành ""and so + trợ động từ + S"" để viết lại ý nghĩa của ""Both... and...""."
22,Seeing that he was angry she left the office.,She didn't want to make him angry so she left.,He wouldn't have been so angry if she hadn't been there.,He grew very angry when he saw her leaving the office.,She left the office when she saw how angry he was.,D,"Rút gọn mệnh đề trạng ngữ ""Seeing that..."" chuyển về mệnh đề thời gian với ""when""."
23,He felt very tired. He was determined to continue to climb up the mountain.,He felt so tired that he was determined to continue to climb up the mountain.,Feeling very tired he was determined to continue to climb up the mountain.,Tired as he might he was determined to continue to climb up the mountain.,As result of his tiredness he was determined to continue to climb up the mountain.,C,"Sử dụng cấu trúc nhượng bộ ""Adj + as + S + might"" (Mặc dù anh ấy có mệt thế nào)."
24,The weather was so dismal. They had to cancel the picnic immediately.,The weather was too dismal that the picnic was cancelled immediately.,The picnic would be cancelled immediately since the weather was dismal.,So dismal was the weather that they had to cancel the picnic immediately.,The weather was enough dismal for them to cancel the picnic immediately.,C,"Đảo ngữ với So: ""So + adj + be + S + that..."" để nhấn mạnh mức độ của thời tiết."
25,"The coffee was not strong, so it didn't keep us awake.",The coffee was not strong enough to keep us awake.,The coffee was very strong but it couldn't keep us awake.,We are kept awake because the coffee was strong.,The coffee was so hot that it didn't keep us awake.,A,"Sử dụng cấu trúc ""not + adj + enough + to V"" (không đủ... để làm gì) thay thế cho câu kết quả với ""so""."